NAME: IMMORTAL BREWING COMPANY, CITY: LAS VEGAS, STATE: NEVADA, COUNTRY: UNITED STATES
NAME: IMPERIAL OAK BREWING CO, CITY: WILLOW SPRINGS, STATE: ILLINOIS, COUNTRY: UNITED STATES
NAME: IMPERIUM BREWING, CITY: HICKORY, STATE: PENNSYLVANIA, COUNTRY: UNITED STATES
NAME: IMPRINT BEER COMPANY, CITY: HATFIELD, STATE: PENNSYLVANIA, COUNTRY: UNITED STATES
NAME: IN THE LOOP BREWING, CITY: LAND O LAKES, STATE: FLORIDA, COUNTRY: UNITED STATES
NAME: IN THE SHADOW BREWING, CITY: ARLINGTON, STATE: WASHINGTON, COUNTRY: UNITED STATES
NAME: IN-LAW BREWING CO, CITY: CHASE MILLS, STATE: NEW YORK, COUNTRY: UNITED STATES
NAME: INBOUND BREWCO, CITY: MINNEAPOLIS, STATE: MINNESOTA, COUNTRY: UNITED STATES
NAME: INC 82 BREWING, CITY: DUBLIN, STATE: CALIFORNIA, COUNTRY: UNITED STATES
NAME: INCENDIARY BREWING COMPANY, CITY: WINSTON SALEM, STATE: NORTH CAROLINA, COUNTRY: UNITED STATES
NAME: INCLINE BREWING, CITY: LARKSPUR, STATE: COLORADO, COUNTRY: UNITED STATES
NAME: INDEED BREWING CO, CITY: MINNEAPOLIS, STATE: MINNESOTA, COUNTRY: UNITED STATES
NAME: INDEPENDENCE BREWING, CITY: AUSTIN, STATE: TEXAS, COUNTRY: UNITED STATES
NAME: INDEPENDENT BREWING CO, CITY: OAKLAND, STATE: CALIFORNIA, COUNTRY: UNITED STATES
NAME: INDEPENDENT BREWING COMPANY, CITY: BEL AIR, STATE: MARYLAND, COUNTRY: UNITED STATES
NAME: INDEPENDENT FERMENTATIONS BREWING, CITY: PLYMOUTH, STATE: MASSACHUSETTS, COUNTRY: UNITED STATES
NAME: INDIAN JOE BREWING, CITY: VISTA, STATE: CALIFORNIA, COUNTRY: UNITED STATES
NAME: INDIAN LADDER FARMSTEAD BREWERY AND CIDERY, CITY: ALTAMONT, STATE: NEW YORK, COUNTRY: UNITED STATES
NAME: INDIAN SPRINGS BREWING COMPANY, CITY: NEOSHO, STATE: MISSOURI, COUNTRY: UNITED STATES
NAME: INDIAN VALLEY BREWING, CITY: NOVATO, STATE: CALIFORNIA, COUNTRY: UNITED STATES
NAME: INDIAN WELLS BREWING CO, CITY: INYOKERN, STATE: CALIFORNIA, COUNTRY: UNITED STATES
NAME: INDIANA CITY BREWING, CITY: INDIANAPOLIS, STATE: INDIANA, COUNTRY: UNITED STATES
NAME: INDIE BREWING COMPANY, CITY: LOS ANGELES, STATE: CALIFORNIA, COUNTRY: UNITED STATES
NAME: INDIGO REEF BREWING COMPANY, CITY: CHARLESTON, STATE: SOUTH CAROLINA, COUNTRY: UNITED STATES
NAME: INDUSTRIAL ARTS BREWING CO., CITY: GARNERVILLE, STATE: NEW YORK, COUNTRY: UNITED STATES
NAME: INDUSTRIAL REVOLUTION BREWING COMPANY, CITY: ERIE, STATE: COLORADO, COUNTRY: UNITED STATES
NAME: INDUSTRY BREWERY, CITY: HOUSTON, STATE: TEXAS, COUNTRY: UNITED STATES
NAME: INDUSTRY BREWING, CITY: PEORIA, STATE: ILLINOIS, COUNTRY: UNITED STATES
NAME: INFAMOUS BREWING, CITY: AUSTIN, STATE: TEXAS, COUNTRY: UNITED STATES
NAME: INFINITE ALE WORKS, CITY: OCALA, STATE: FLORIDA, COUNTRY: UNITED STATES
NAME: INFUSION BREWING COMPANY, CITY: OMAHA, STATE: NEBRASKA, COUNTRY: UNITED STATES
NAME: INFUSION BREWING COMPANY, CITY: OMAHA, STATE: NEBRASKA, COUNTRY: UNITED STATES
NAME: INFUSION BREWING COMPANY OF TRINITY, CITY: NEW PORT RICHEY, STATE: FLORIDA, COUNTRY: UNITED STATES
NAME: INGENIOUS BREWING COMPANY, CITY: HUMBLE, STATE: TEXAS, COUNTRY: UNITED STATES
NAME: INLAND ALE WORKS BREWING CO, CITY: CHENEY, STATE: WASHINGTON, COUNTRY: UNITED STATES
NAME: INLAND EMPIRE BREWING CO, CITY: RIVERSIDE, STATE: CALIFORNIA, COUNTRY: UNITED STATES
NAME: INLAND WHARF BREWING COMPANY, CITY: MURRIETA, STATE: CALIFORNIA, COUNTRY: UNITED STATES
NAME: INLET BREWING CO, CITY: JUPITER, STATE: FLORIDA, COUNTRY: UNITED STATES
NAME: INN ON PEAKS ISLAND BREWERY, THE, CITY: PEAKS ISLAND, STATE: MAINE, COUNTRY: UNITED STATES
NAME: INNER COMPASS BREWING, CITY: SANFORD, STATE: FLORIDA, COUNTRY: UNITED STATES
NAME: INNERSPACE BREWING COMPANY, CITY: HUNTSVILLE, STATE: ALABAMA, COUNTRY: UNITED STATES
NAME: INNOVATION BREW WORKS, CITY: POMONA, STATE: CALIFORNIA, COUNTRY: UNITED STATES
NAME: INNOVATION BREWING, CITY: SYLVA, STATE: NORTH CAROLINA, COUNTRY: UNITED STATES
NAME: INOCULUM ALE WORKS, CITY: SPRING HILL, STATE: FLORIDA, COUNTRY: UNITED STATES
NAME: INSIDE PASSAGE BREWING COMPANY LLC, CITY: KETCHIKAN, STATE: ALASKA, COUNTRY: UNITED STATES
NAME: INSIDE THE FIVE BREWING, CITY: SYLVANIA, STATE: OHIO, COUNTRY: UNITED STATES
NAME: INSIGHT BREWING COMPANY, CITY: MINNEAPOLIS, STATE: MINNESOTA, COUNTRY: UNITED STATES
NAME: INSTITUTION ALE COMPANY, CITY: CAMARILLO, STATE: CALIFORNIA, COUNTRY: UNITED STATES
NAME: INSURGENT BREWING CO. LLC, CITY: CHINO VALLEY, STATE: ARIZONA, COUNTRY: UNITED STATES
NAME: INSURRECTION ALEWORKS, CITY: HEIDELBERG, STATE: PENNSYLVANIA, COUNTRY: UNITED STATES
NAME: INTERBORO SPIRITS AND ALES, CITY: BROOKLYN, STATE: NEW YORK, COUNTRY: UNITED STATES
NAME: INTERCOURSE BREWING CO, CITY: COLLEGEVILLE, STATE: PENNSYLVANIA, COUNTRY: UNITED STATES
NAME: INTERGALACTIC BREWING CO, CITY: SAN DIEGO, STATE: CALIFORNIA, COUNTRY: UNITED STATES
NAME: INTERMISSION BEER COMPANY, CITY: GLEN ALLEN, STATE: VIRGINIA, COUNTRY: UNITED STATES
NAME: INTERSECT BREWING, CITY: FORT COLLINS, STATE: COLORADO, COUNTRY: UNITED STATES
NAME: INTERVENTION BREWING COMPANY, LLC, CITY: IRVING, STATE: TEXAS, COUNTRY: UNITED STATES
NAME: INTRACOASTAL BREWING CO., CITY: MELBOURNE, STATE: FLORIDA, COUNTRY: UNITED STATES
NAME: INTRINSIC BREWING, CITY: GARLAND, STATE: TEXAS, COUNTRY: UNITED STATES
NAME: INTUITION ALE WORKS, CITY: JACKSONVILLE, STATE: FLORIDA, COUNTRY: UNITED STATES
NAME: INTUITION ALE WORKS PRODUCTION FACILITY, CITY: JACKSONVILLE, STATE: FLORIDA, COUNTRY: UNITED STATES
NAME: INU ISLAND ALES, CITY: KANEOHE, STATE: HAWAII, COUNTRY: UNITED STATES
NAME: INVASIVE SPECIES BREWING, CITY: FORT LAUDERDALE, STATE: FLORIDA, COUNTRY: UNITED STATES
NAME: INVENTORS BREWPUB, CITY: PORT WASHINGTON, STATE: WISCONSIN, COUNTRY: UNITED STATES
NAME: INVICTUS BREWING CO, CITY: BLAINE, STATE: MINNESOTA, COUNTRY: UNITED STATES
NAME: INVICTUS BREWING CO., CITY: BLAINE, STATE: MINNESOTA, COUNTRY: UNITED STATES
NAME: IOWA BREWING COMPANY, CITY: CEDAR RAPIDS, STATE: IOWA, COUNTRY: UNITED STATES
NAME: IOWA RIVER BREWING COMPANY, CITY: MARSHALLTOWN, STATE: IOWA, COUNTRY: UNITED STATES
NAME: IPSWICH ALE BREWERY, CITY: IPSWICH, STATE: MASSACHUSETTS, COUNTRY: UNITED STATES
NAME: IRISH MAFIA BREWING CO, CITY: BLOOMFIELD, STATE: NEW YORK, COUNTRY: UNITED STATES
NAME: IRON BEARD BREWING, CITY: JERSEY CITY, STATE: NEW JERSEY, COUNTRY: UNITED STATES
NAME: IRON BIRD BREWING CO., CITY: COLORADO SPRINGS, STATE: COLORADO, COUNTRY: UNITED STATES
NAME: IRON BREWING COMPANY, CITY: NORWALK, STATE: CONNECTICUT, COUNTRY: UNITED STATES
NAME: IRON DUKE BREWING CO, CITY: LUDLOW, STATE: MASSACHUSETTS, COUNTRY: UNITED STATES
NAME: IRON FIST BREWING CO, CITY: VISTA, STATE: CALIFORNIA, COUNTRY: UNITED STATES
NAME: IRON FLAMINGO BREWERY, CITY: CORNING, STATE: NEW YORK, COUNTRY: UNITED STATES
NAME: IRON GOAT BREWING, CITY: SPOKANE, STATE: WASHINGTON, COUNTRY: UNITED STATES
NAME: IRON HART, CITY: CARBONDALE, STATE: PENNSYLVANIA, COUNTRY: UNITED STATES
NAME: IRON HILL BREWERY & RESTAURANT - CHESTNUT HILL, CITY: PHILADELPHIA, STATE: PENNSYLVANIA, COUNTRY: UNITED STATES
NAME: IRON HILL BREWERY & RESTAURANT - GREENVILLE, CITY: GREENVILLE, STATE: SOUTH CAROLINA, COUNTRY: UNITED STATES
NAME: IRON HILL BREWERY & RESTAURANT - HUNTINGDON VALLEY, CITY: HUNTINGDON VALLEY, STATE: PENNSYLVANIA, COUNTRY: UNITED STATES
NAME: IRON HILL BREWERY & RESTAURANT - LANCASTER, CITY: LANCASTER, STATE: PENNSYLVANIA, COUNTRY: UNITED STATES
NAME: IRON HILL BREWERY & RESTAURANT - MAPLE SHADE, CITY: MAPLE SHADE, STATE: NEW JERSEY, COUNTRY: UNITED STATES
NAME: IRON HILL BREWERY & RESTAURANT - MEDIA, CITY: MEDIA, STATE: PENNSYLVANIA, COUNTRY: UNITED STATES
NAME: IRON HILL BREWERY & RESTAURANT - NEWARK, CITY: NEWARK, STATE: DELAWARE, COUNTRY: UNITED STATES
NAME: IRON HILL BREWERY & RESTAURANT - NORTH WALES, CITY: NORTH WALES, STATE: PENNSYLVANIA, COUNTRY: UNITED STATES
NAME: IRON HILL BREWERY & RESTAURANT - PHOENIXVILLE, CITY: PHOENIXVILLE, STATE: PENNSYLVANIA, COUNTRY: UNITED STATES
NAME: IRON HILL BREWERY & RESTAURANT - REHOBOTH BEACH, CITY: REHOBOTH BEACH, STATE: DELAWARE, COUNTRY: UNITED STATES
NAME: IRON HILL BREWERY & RESTAURANT - VOORHEES, CITY: VOORHEES, STATE: NEW JERSEY, COUNTRY: UNITED STATES
NAME: IRON HILL BREWERY & RESTAURANT - WEST CHESTER, CITY: WEST CHESTER, STATE: PENNSYLVANIA, COUNTRY: UNITED STATES
NAME: IRON HILL BREWERY & RESTAURANT - WILMINGTON, CITY: WILMINGTON, STATE: DELAWARE, COUNTRY: UNITED STATES
NAME: IRON HILL BREWERY & RESTAURANT (ARDMORE), CITY: ARDMORE, STATE: PENNSYLVANIA, COUNTRY: UNITED STATES
NAME: IRON HORSE BREWERY, CITY: ELLENSBURG, STATE: WASHINGTON, COUNTRY: UNITED STATES
NAME: IRON JOHN'S BREWING COMPANY, CITY: TUCSON, STATE: ARIZONA, COUNTRY: UNITED STATES
NAME: IRON MONK BREWING COMPANY, CITY: STILLWATER, STATE: OKLAHOMA, COUNTRY: UNITED STATES
NAME: IRON SPIKE BREWING COMPANY, CITY: GALESBURG, STATE: ILLINOIS, COUNTRY: UNITED STATES
NAME: IRON SPRINGS PUB & BREWERY, CITY: FAIRFAX, STATE: CALIFORNIA, COUNTRY: UNITED STATES
NAME: IRON TREE TABLE & TAPS, CITY: FLORISSANT, STATE: COLORADO, COUNTRY: UNITED STATES
NAME: IRON TRIANGLE BREWING COMPANY, CITY: LOS ANGELES, STATE: CALIFORNIA, COUNTRY: UNITED STATES
NAME: IRON TUG BREWING, CITY: ROCHESTER, STATE: NEW YORK, COUNTRY: UNITED STATES
NAME: IRONBARK BREWERY, CITY: JACKSON, STATE: MICHIGAN, COUNTRY: UNITED STATES
NAME: IRONCLAD BREWERY, CITY: WILMINGTON, STATE: NORTH CAROLINA, COUNTRY: UNITED STATES
NAME: IRONFIRE BREWING COMPANY, CITY: TEMECULA, STATE: CALIFORNIA, COUNTRY: UNITED STATES
NAME: IRONMONGER BREWING, CITY: MARIETTA, STATE: GEORGIA, COUNTRY: UNITED STATES
NAME: IRONWOOD BREWING CO LLC, CITY: VALPARAISO, STATE: INDIANA, COUNTRY: UNITED STATES
NAME: IRONWOOD CREEK, CITY: EVANS, STATE: GEORGIA, COUNTRY: UNITED STATES
NAME: IRONWORKS BREWERY & PUB, CITY: LAKEWOOD, STATE: COLORADO, COUNTRY: UNITED STATES
NAME: IRVING CLIFF BREWERY, CITY: HONESDALE, STATE: PENNSYLVANIA, COUNTRY: UNITED STATES
NAME: IRWIN BREWING COMPANY, CITY: CRESTED BUTTE, STATE: COLORADO, COUNTRY: UNITED STATES
NAME: ISLAMORADA BEER COMPANY, CITY: ISLAMORADA, STATE: FLORIDA, COUNTRY: UNITED STATES
NAME: ISLAND BREWING CO, CITY: CARPINTERIA, STATE: CALIFORNIA, COUNTRY: UNITED STATES
NAME: ISLAND CITY BREWING COMPANY, CITY: WINONA, STATE: MINNESOTA, COUNTRY: UNITED STATES
NAME: ISLAND COASTAL LAGER, CITY: LAKELAND, STATE: FLORIDA, COUNTRY: UNITED STATES
NAME: ISLAND DOG BREWING, CITY: SOUTH PORTLAND, STATE: MAINE, COUNTRY: UNITED STATES
NAME: ISLAND HOPPIN' BREWERY, CITY: EASTSOUND, STATE: WASHINGTON, COUNTRY: UNITED STATES
NAME: ISLAND TO ISLAND BREWERY, CITY: BROOKLYN, STATE: NEW YORK, COUNTRY: UNITED STATES
NAME: ISLAY ALES, CITY: ISLE OF ISLAY, STATE: ARGYLL, COUNTRY: SCOTLAND
NAME: ISLEY BREWING COMPANY, CITY: RICHMOND, STATE: VIRGINIA, COUNTRY: UNITED STATES
NAME: ISLLA STREET BREWING COMPANY, CITY: SAN ANTONIO, STATE: TEXAS, COUNTRY: UNITED STATES
NAME: ITASCA BREWING COMPANY INC, CITY: ITASCA, STATE: ILLINOIS, COUNTRY: UNITED STATES
NAME: ITHACA BEER CO, CITY: ITHACA, STATE: NEW YORK, COUNTRY: UNITED STATES
NAME: IVANHOE ALEWORKS, CITY: DENISON, STATE: TEXAS, COUNTRY: UNITED STATES
NAME: IVANHOE PARK BREWING COMPANY, CITY: ORLANDO, STATE: FLORIDA, COUNTRY: UNITED STATES
NAME: IVORY TOWER BREWERY, CITY: BOONE, STATE: NORTH CAROLINA, COUNTRY: UNITED STATES
NAME: J MOE'S BREWING COMPANY, CITY: DENVER, STATE: COLORADO, COUNTRY: UNITED STATES
NAME: J WAKEFIELD BREWING, CITY: MIAMI, STATE: FLORIDA, COUNTRY: UNITED STATES
NAME: J. FARGO'S FAMILY DINING & MICRO BREWERY / COYOTE J BREWING CO, CITY: CORTEZ, STATE: COLORADO, COUNTRY: UNITED STATES
NAME: J.J. BITTING BREWING CO., CITY: WOODBRIDGE, STATE: NEW JERSEY, COUNTRY: UNITED STATES
NAME: J.W. SWEETMAN, CITY: DUBLIN, STATE: DUBLIN, COUNTRY: IRELAND
NAME: J'VILLE BREWERY, CITY: JACKSONVILLE, STATE: VERMONT, COUNTRY: UNITED STATES
NAME: JACK MASON'S TAVERN AND BREWERY, CITY: CLIFTON FORGE, STATE: VIRGINIA, COUNTRY: UNITED STATES
NAME: JACK PINE BREWERY, CITY: BAXTER, STATE: MINNESOTA, COUNTRY: UNITED STATES
NAME: JACK RUSSELL FARM ALES, CITY: CAMINO, STATE: CALIFORNIA, COUNTRY: UNITED STATES
NAME: JACK RUSSELL'S STEAKHOUSE AND BREWERY / MAINE COAST BREWING CO., CITY: BAR HARBOR, STATE: MAINE, COUNTRY: UNITED STATES
NAME: JACK'S ABBY BREWING, CITY: FRAMINGHAM, STATE: MASSACHUSETTS, COUNTRY: UNITED STATES
NAME: JACK'S BREWING CO, CITY: FREMONT, STATE: CALIFORNIA, COUNTRY: UNITED STATES
NAME: JACK'S RUN BREWING CO, CITY: PURCELLVILLE, STATE: VIRGINIA, COUNTRY: UNITED STATES
NAME: JACKALOPE BREWING COMPANY, LLC, CITY: NASHVILLE, STATE: TENNESSEE, COUNTRY: UNITED STATES
NAME: JACKED UP BREWERY, CITY: ESCONDIDO, STATE: CALIFORNIA, COUNTRY: UNITED STATES
NAME: JACKIE O'S BREWERY, CITY: ATHENS, STATE: OHIO, COUNTRY: UNITED STATES
NAME: JACKIE O'S PUB & BREWERY, CITY: ATHENS, STATE: OHIO, COUNTRY: UNITED STATES
NAME: JACKRABBIT BREWING CO, CITY: WEST SACRAMENTO, STATE: CALIFORNIA, COUNTRY: UNITED STATES
NAME: JACKSON STREET BREW CO., CITY: PERRYVILLE, STATE: MISSOURI, COUNTRY: UNITED STATES
NAME: JACKSON STREET BREWING, CITY: SIOUX CITY, STATE: IOWA, COUNTRY: UNITED STATES
NAME: JACOB LEINENKUGEL BREWING CO, CITY: CHIPPEWA FALLS, STATE: WISCONSIN, COUNTRY: UNITED STATES
NAME: JADEN JAMES BREWERY @ THE CASCADE WINERY, CITY: GRAND RAPIDS, STATE: MICHIGAN, COUNTRY: UNITED STATES
NAME: JAFB BREWERY, CITY: WOOSTER, STATE: OHIO, COUNTRY: UNITED STATES
NAME: JAGGED MOUNTAIN BREWERY, CITY: DENVER, STATE: COLORADO, COUNTRY: UNITED STATES
NAME: JAILBREAK BREWING COMPANY, CITY: LAUREL, STATE: MARYLAND, COUNTRY: UNITED STATES
NAME: JAILHOUSE BREWING CO, CITY: HAMPTON, STATE: GEORGIA, COUNTRY: UNITED STATES
NAME: JAIPUR RESTAURANT AND BREWPUB, CITY: OMAHA, STATE: NEBRASKA, COUNTRY: UNITED STATES
NAME: JAKS BREWING COMPANY, CITY: PEYTON, STATE: COLORADO, COUNTRY: UNITED STATES
NAME: JAM ROOM BREWING CO, CITY: NEWFOUNDLAND, STATE: PENNSYLVANIA, COUNTRY: UNITED STATES
NAME: JAMES PEAK BREWERY, CITY: NEDERLAND, STATE: COLORADO, COUNTRY: UNITED STATES
NAME: JAMES RIVER BREWERY, CITY: SCOTTSVILLE, STATE: VIRGINIA, COUNTRY: UNITED STATES
NAME: JAMESPORT BREWING CO, CITY: LUDINGTON, STATE: MICHIGAN, COUNTRY: UNITED STATES
NAME: JAMESPORT FARM BREWERY, CITY: RIVERHEAD, STATE: NEW YORK, COUNTRY: UNITED STATES
NAME: JAMESTOWN BREWING COMPANY, CITY: JAMESTOWN, STATE: NEW YORK, COUNTRY: UNITED STATES
NAME: JAMEX BREWING CO, CITY: SAINT CLAIR SHORES, STATE: MICHIGAN, COUNTRY: UNITED STATES
NAME: JAMUL BREWING CO. - PRODUCTION ONLY, CITY: JAMUL, STATE: CALIFORNIA, COUNTRY: UNITED STATES
NAME: JARFLY BREWING CO, CITY: SOMERSET, STATE: KENTUCKY, COUNTRY: UNITED STATES
NAME: JASPER RIDGE BREWING CO, CITY: ISHPEMING, STATE: MICHIGAN, COUNTRY: UNITED STATES
NAME: JAW BREW, CITY: MILNGAVIE, STATE: EAST DUNBARTONSHIRE, COUNTRY: SCOTLAND
NAME: JAWORZYŃSKI BROWAR RZEMIEŚLNICZY JAUER, CITY: LEGNICKIE POLE, STATE: DOLNOŚLĄSKIE, COUNTRY: POLAND
NAME: JC BREWHOUSE, CITY: ISSAQUAH, STATE: WASHINGTON, COUNTRY: UNITED STATES
NAME: JD'S SPORTS PUB AND BREWERY, CITY: GRANTS PASS, STATE: OREGON, COUNTRY: UNITED STATES
NAME: JDUB'S BREWING CO., CITY: SARASOTA, STATE: FLORIDA, COUNTRY: UNITED STATES
NAME: JEKYLL BREWING, CITY: ALPHARETTA, STATE: GEORGIA, COUNTRY: UNITED STATES
NAME: JELLYFISH BREWING COMPANY, CITY: SEATTLE, STATE: WASHINGTON, COUNTRY: UNITED STATES
NAME: JEREMIAH JOHNSON BREWING COMPANY, CITY: GREAT FALLS, STATE: MONTANA, COUNTRY: UNITED STATES
NAME: JERSEY GIRL BREWING COMPANY, CITY: HACKETTSTOWN, STATE: NEW JERSEY, COUNTRY: UNITED STATES
NAME: JESSUP FARM BARREL HOUSE, CITY: FORT COLLINS, STATE: COLORADO, COUNTRY: UNITED STATES
NAME: JESTER KING BREWERY, CITY: AUSTIN, STATE: TEXAS, COUNTRY: UNITED STATES
NAME: JGR ENTERPRISES INC, CITY: OMAHA, STATE: NEBRASKA, COUNTRY: UNITED STATES
NAME: JIG HEAD BREWING COMPANY, CITY: COOKEVILLE, STATE: TENNESSEE, COUNTRY: UNITED STATES
NAME: JIGSAW BREWING, LLC, CITY: HIGH POINT, STATE: NORTH CAROLINA, COUNTRY: UNITED STATES
NAME: JIGSY'S BREWPUB & RESTAURANT, CITY: ENOLA, STATE: PENNSYLVANIA, COUNTRY: UNITED STATES
NAME: JIM DANDY BREWING, CITY: POCATELLO, STATE: IDAHO, COUNTRY: UNITED STATES
NAME: JJS BREWING COMPANY, CITY: FAYETTEVILLE, STATE: ARKANSAS, COUNTRY: UNITED STATES
NAME: JOBOY'S BREW PUB, CITY: LITITZ, STATE: PENNSYLVANIA, COUNTRY: UNITED STATES
NAME: JOHANSSONS DINING HOUSE, CITY: WESTMINSTER, STATE: MARYLAND, COUNTRY: UNITED STATES
NAME: JOHN HARVARDS BREW HOUSE - FRAMINGHAM, CITY: FRAMINGHAM, STATE: MASSACHUSETTS, COUNTRY: UNITED STATES
NAME: JOHN S. RHODELL BREWERY, CITY: PEORIA, STATE: ILLINOIS, COUNTRY: UNITED STATES
NAME: JOHN SCOTT BREWING CO., CITY: TRABUCO CANYON, STATE: CALIFORNIA, COUNTRY: UNITED STATES
NAME: JOHNNIE BYRD BREWING COMPANY, CITY: WAYNE, STATE: NEBRASKA, COUNTRY: UNITED STATES
NAME: JOHNNIE MACCRACKEN'S CELTIC FIREHOUSE PUB, INC., CITY: MARIETTA, STATE: GEORGIA, COUNTRY: UNITED STATES
NAME: JOHNNY'S CALISTOGA / MUD CITY BREWS, CITY: CALISTOGA, STATE: CALIFORNIA, COUNTRY: UNITED STATES
NAME: JOHNSON CITY BREWING CO, CITY: JOHNSON CITY, STATE: TENNESSEE, COUNTRY: UNITED STATES
NAME: JOLLY PUMPKIN ARTISAN ALES, CITY: DEXTER, STATE: MICHIGAN, COUNTRY: UNITED STATES
NAME: JOLLY PUMPKIN CAFE AND BREWERY, CITY: ANN ARBOR, STATE: MICHIGAN, COUNTRY: UNITED STATES
NAME: JOLLY PUMPKIN PIZZERIA AND BREWERY, CITY: GRAND RAPIDS, STATE: MICHIGAN, COUNTRY: UNITED STATES
NAME: JOLLY PUMPKIN RESTAURANT, BREWERY & DISTILLERY, CITY: TRAVERSE CITY, STATE: MICHIGAN, COUNTRY: UNITED STATES
NAME: JOLLY ROGER BREW, CITY: MOORESVILLE, STATE: NORTH CAROLINA, COUNTRY: UNITED STATES
NAME: JONES BREWING CO, CITY: SMITHTON, STATE: PENNSYLVANIA, COUNTRY: UNITED STATES
NAME: JONES CREEK BREWING, CITY: CHEHALIS, STATE: WASHINGTON, COUNTRY: UNITED STATES
NAME: JORDAN LAKE BREWING CO, CITY: CARY, STATE: NORTH CAROLINA, COUNTRY: UNITED STATES
NAME: JOSEPH JAMES BREWING CO, INC, CITY: HENDERSON, STATE: NEVADA, COUNTRY: UNITED STATES
NAME: JOSEPH WOLF BREWING COMPANY, CITY: SAINT PAUL, STATE: MINNESOTA, COUNTRY: UNITED STATES
NAME: JOVIAL FOODS, INC., CITY: NORTH STONINGTON, STATE: CONNECTICUT, COUNTRY: UNITED STATES
NAME: JOYMONGERS BREWING CO., CITY: GREENSBORO, STATE: NORTH CAROLINA, COUNTRY: UNITED STATES
NAME: JOYRIDE BREWING CO, CITY: EDGEWATER, STATE: COLORADO, COUNTRY: UNITED STATES
NAME: JP DASBREW, CITY: FREMONT, STATE: CALIFORNIA, COUNTRY: UNITED STATES
NAME: JRH BREWING, CITY: JOHNSON CITY, STATE: TENNESSEE, COUNTRY: UNITED STATES
NAME: JT SCHMIDS RESTAURANT & BREWERY, CITY: ANAHEIM, STATE: CALIFORNIA, COUNTRY: UNITED STATES
NAME: JT WALKER'S/CHAMPAIGN COUNTY BREWING CO, CITY: MAHOMET, STATE: ILLINOIS, COUNTRY: UNITED STATES
NAME: JUBECK NEW WORLD BREWING, CITY: DUBUQUE, STATE: IOWA, COUNTRY: UNITED STATES
NAME: JUBILEE CRAFT BEER CO, CITY: NASHVILLE, STATE: TENNESSEE, COUNTRY: UNITED STATES
NAME: JUGHANDLE BREWING CO LLC, CITY: TINTON FALLS, STATE: NEW JERSEY, COUNTRY: UNITED STATES
NAME: JUKES ALE WORKS, CITY: OMAHA, STATE: NEBRASKA, COUNTRY: UNITED STATES
NAME: JULIAN BREWING CO, CITY: JULIAN, STATE: CALIFORNIA, COUNTRY: UNITED STATES
NAME: JULIUS LEHRKIND BREWING, CITY: BOZEMAN, STATE: MONTANA, COUNTRY: UNITED STATES
NAME: JUNCTION BREWERY & GRILL, CITY: AMERICAN CANYON, STATE: CALIFORNIA, COUNTRY: UNITED STATES
NAME: JUNE LAKE BREWING, CITY: JUNE LAKE, STATE: CALIFORNIA, COUNTRY: UNITED STATES
NAME: JUNK DITCH BREWING COMPANY, CITY: FORT WAYNE, STATE: INDIANA, COUNTRY: UNITED STATES
NAME: JUNKYARD BREWING COMPANY, CITY: MOORHEAD, STATE: MINNESOTA, COUNTRY: UNITED STATES
NAME: JUPITER, CITY: BERKELEY, STATE: CALIFORNIA, COUNTRY: UNITED STATES
NAME: JURNEE BREWING COMPANY, CITY: CHANTILLY, STATE: VIRGINIA, COUNTRY: UNITED STATES
NAME: K POINT BREWING, CITY: EAU CLAIRE, STATE: WISCONSIN, COUNTRY: UNITED STATES
NAME: K-OZ RESTAURANT BREWERY, CITY: SAN FRANCISCO, STATE: CALIFORNIA, COUNTRY: UNITED STATES
NAME: K2 BROTHERS BREWING, CITY: ROCHESTER, STATE: NEW YORK, COUNTRY: UNITED STATES
NAME: KÃ¼NSTLER BREWING, CITY: SAN ANTONIO, STATE: TEXAS, COUNTRY: UNITED STATES
NAME: KAISER BREWING COMPANY, LLC, CITY: FOREST GROVE, STATE: OREGON, COUNTRY: UNITED STATES
NAME: KAKTUS BREWING CO., CITY: BERNALILLO, STATE: NEW MEXICO, COUNTRY: UNITED STATES
NAME: KALISPELL BREWING CO, CITY: KALISPELL, STATE: MONTANA, COUNTRY: UNITED STATES
NAME: KALONA BREWING COMPANY, CITY: KALONA, STATE: IOWA, COUNTRY: UNITED STATES
NAME: KANE BREWING, CITY: OCEAN, STATE: NEW JERSEY, COUNTRY: UNITED STATES
NAME: KANNAH CREEK BREWING CO, CITY: GRAND JUNCTION, STATE: COLORADO, COUNTRY: UNITED STATES
NAME: KANOOK BEER COMPANY, CITY: GOLDEN, STATE: COLORADO, COUNTRY: UNITED STATES
NAME: KANSAS CITY BIER COMPANY, CITY: KANSAS CITY, STATE: MISSOURI, COUNTRY: UNITED STATES
NAME: KANSAS CITY BREWERIES COMPANY, CITY: OLATHE, STATE: KANSAS, COUNTRY: UNITED STATES
NAME: KANSAS TERRITORY BREWING, CITY: WASHINGTON, STATE: KANSAS, COUNTRY: UNITED STATES
NAME: KARBACH BREWING CO, CITY: HOUSTON, STATE: TEXAS, COUNTRY: UNITED STATES
NAME: KARBEN4 BREWING, CITY: MADISON, STATE: WISCONSIN, COUNTRY: UNITED STATES
NAME: KARETAS BREWING, CITY: ITASCA, STATE: ILLINOIS, COUNTRY: UNITED STATES
NAME: KARL STRAUSS BREWING CO, CITY: SAN DIEGO, STATE: CALIFORNIA, COUNTRY: UNITED STATES
NAME: KARL STRAUSS BREWING CO, CITY: TEMECULA, STATE: CALIFORNIA, COUNTRY: UNITED STATES
NAME: KARL STRAUSS BREWING CO - 4S RANCH, CITY: SAN DIEGO, STATE: CALIFORNIA, COUNTRY: UNITED STATES
NAME: KARL STRAUSS BREWING CO - ANAHEIM, CITY: ANAHEIM, STATE: CALIFORNIA, COUNTRY: UNITED STATES
NAME: KARL STRAUSS BREWING CO - CARLSBAD, CITY: CARLSBAD, STATE: CALIFORNIA, COUNTRY: UNITED STATES
NAME: KARL STRAUSS BREWING CO - COSTA MESA, CITY: COSTA MESA, STATE: CALIFORNIA, COUNTRY: UNITED STATES
NAME: KARL STRAUSS BREWING CO - DOWNTOWN, CITY: SAN DIEGO, STATE: CALIFORNIA, COUNTRY: UNITED STATES
NAME: KARL STRAUSS BREWING CO - DOWNTOWN LOS ANGELES, CITY: LOS ANGELES, STATE: CALIFORNIA, COUNTRY: UNITED STATES
NAME: KARL STRAUSS BREWING CO - LA JOLLA, CITY: LA JOLLA, STATE: CALIFORNIA, COUNTRY: UNITED STATES
NAME: KARL STRAUSS BREWING CO - SORRENTO MESA, CITY: SAN DIEGO, STATE: CALIFORNIA, COUNTRY: UNITED STATES
NAME: KARL STRAUSS BREWING CO - UNIVERSAL CITYWALK, CITY: UNIVERSAL CITY, STATE: CALIFORNIA, COUNTRY: UNITED STATES
NAME: KARST BREWING LLC, CITY: FOUNTAIN, STATE: MINNESOTA, COUNTRY: UNITED STATES
NAME: KASSIK'S BREWERY, CITY: KENAI, STATE: ALASKA, COUNTRY: UNITED STATES
NAME: KASTAWAY BREWING CO, CITY: KATY, STATE: TEXAS, COUNTRY: UNITED STATES
NAME: KATABATIC BREWING CO, CITY: LIVINGSTON, STATE: MONTANA, COUNTRY: UNITED STATES
NAME: KATHRIN'S BIERGARTEN, CITY: ROCKLIN, STATE: CALIFORNIA, COUNTRY: UNITED STATES
NAME: KAUAI BEER COMPANY, CITY: LIHUE, STATE: HAWAII, COUNTRY: UNITED STATES
NAME: KAUAI ISLAND BREWERY, CITY: ELEELE, STATE: HAWAII, COUNTRY: UNITED STATES
NAME: KAWEAH BREWING CO., CITY: TULARE, STATE: CALIFORNIA, COUNTRY: UNITED STATES
NAME: KEEGAN ALES, CITY: KINGSTON, STATE: NEW YORK, COUNTRY: UNITED STATES
NAME: KEEN BREWING, CITY: JACKSONVILLE, STATE: FLORIDA, COUNTRY: UNITED STATES
NAME: KEG & LANTERN BREWING CO, CITY: BROOKLYN, STATE: NEW YORK, COUNTRY: UNITED STATES
NAME: KEG CREEK BREWING COMPANY, CITY: GLENWOOD, STATE: IOWA, COUNTRY: UNITED STATES
NAME: KEG GROVE BREWING COMPANY, CITY: BLOOMINGTON, STATE: ILLINOIS, COUNTRY: UNITED STATES
NAME: KEGG BREWING COMPANY, CITY: CHAMPION, STATE: PENNSYLVANIA, COUNTRY: UNITED STATES
NAME: KELLS BREW PUB, CITY: PORTLAND, STATE: OREGON, COUNTRY: UNITED STATES
NAME: KELLY GREEN BREWING CO., CITY: PITMAN, STATE: NEW JERSEY, COUNTRY: UNITED STATES
NAME: KELLYS BREWPUB, CITY: ALBUQUERQUE, STATE: NEW MEXICO, COUNTRY: UNITED STATES
NAME: KELSEN BREWING COMPANY, CITY: DERRY, STATE: NEW HAMPSHIRE, COUNTRY: UNITED STATES
NAME: KELSEY BLOCK BREWING COMPANY, CITY: THREE RIVERS, STATE: MICHIGAN, COUNTRY: UNITED STATES
NAME: KELSEY CREEK BREWING, CITY: KELSEYVILLE, STATE: CALIFORNIA, COUNTRY: UNITED STATES
NAME: KELSO BEER COMPANY, CITY: BROOKLYN, STATE: NEW YORK, COUNTRY: UNITED STATES
NAME: KENAI RIVER BREWING CO, CITY: SOLDOTNA, STATE: ALASKA, COUNTRY: UNITED STATES
NAME: KENNEBEC RIVER BREWERY, CITY: WEST FORKS, STATE: MAINE, COUNTRY: UNITED STATES
NAME: KENNEBUNKPORT BREWERY / FEDERAL JACKS, CITY: KENNEBUNK, STATE: MAINE, COUNTRY: UNITED STATES
NAME: KENNEDY VINEYARD, CITY: NEW MADISON, STATE: OHIO, COUNTRY: UNITED STATES
NAME: KENNETT BREWING COMPANY, CITY: KENNETT SQUARE, STATE: PENNSYLVANIA, COUNTRY: UNITED STATES
NAME: KENSINGTON BARREL PROJECT, CITY: PHILADELPHIA, STATE: PENNSYLVANIA, COUNTRY: UNITED STATES
NAME: KENT FALLS BREWING COMPANY, CITY: KENT, STATE: CONNECTICUT, COUNTRY: UNITED STATES
NAME: KERN RIVER BREWING CO, CITY: KERNVILLE, STATE: CALIFORNIA, COUNTRY: UNITED STATES
NAME: KERNERSVILLE BREWING COMPANY, CITY: KERNERSVILLE, STATE: NORTH CAROLINA, COUNTRY: UNITED STATES
NAME: KETTLE AND SPOKE BREWERY, LLC, CITY: BOULDER, STATE: COLORADO, COUNTRY: UNITED STATES
NAME: KETTLE HOUSE BREWING CO., CITY: BONNER, STATE: MONTANA, COUNTRY: UNITED STATES
NAME: KETTLEHEAD BREWING COMPANY, CITY: TILTON, STATE: NEW HAMPSHIRE, COUNTRY: UNITED STATES
NAME: KETTLEHOUSE BREWING CO - BONNER BREWERY, CITY: BONNER, STATE: MONTANA, COUNTRY: UNITED STATES
NAME: KETTLEHOUSE BREWING CO - SOUTHSIDE, CITY: MISSOULA, STATE: MONTANA, COUNTRY: UNITED STATES
NAME: KEUKA BREWING CO, CITY: HAMMONDSPORT, STATE: NEW YORK, COUNTRY: UNITED STATES
NAME: KEWEENAW BREWING CO, CITY: HOUGHTON, STATE: MICHIGAN, COUNTRY: UNITED STATES
NAME: KEWEENAW BREWING CO - PRODUCTION FACILITY, CITY: HOUGHTON, STATE: MICHIGAN, COUNTRY: UNITED STATES
NAME: KEY BREWING CO., CITY: DUNDALK, STATE: MARYLAND, COUNTRY: UNITED STATES
NAME: KEY CITY BREWING CO., CITY: VICKSBURG, STATE: MISSISSIPPI, COUNTRY: UNITED STATES
NAME: KEYHOLE VALLEY BREWING, CITY: SHELTON, STATE: WASHINGTON, COUNTRY: UNITED STATES
NAME: KHOFFNER BREWERY LTD, CITY: FORT LAUDERDALE, STATE: FLORIDA, COUNTRY: UNITED STATES
NAME: KICKBACK BREWERY, CITY: WESTFORD, STATE: VERMONT, COUNTRY: UNITED STATES
