NAME: CHRISTIAN MOERLEIN BREWING CO, CITY: CINCINNATI, STATE: OHIO, COUNTRY: UNITED STATES
NAME: CHUBBY SQUIRREL BREWING COMPANY, CITY: FAIRFAX, STATE: VIRGINIA, COUNTRY: UNITED STATES
NAME: CHUCKALEK INDEPENDENT BREWERS, CITY: RAMONA, STATE: CALIFORNIA, COUNTRY: UNITED STATES
NAME: CHUCKANUT - SOUTH NUT, CITY: BURLINGTON, STATE: WASHINGTON, COUNTRY: UNITED STATES
NAME: CHUCKANUT BREWERY - NORTH NUT, CITY: BELLINGHAM, STATE: WASHINGTON, COUNTRY: UNITED STATES
NAME: CHULA VISTA BREWERY, CITY: CHULA VISTA, STATE: CALIFORNIA, COUNTRY: UNITED STATES
NAME: CHURCH BREW WORKS/LAWRENCEVILLE BREWERY INC., CITY: PITTSBURGH, STATE: PENNSYLVANIA, COUNTRY: UNITED STATES
NAME: CHURCH OWL BEER, CITY: STRATFORD, STATE: CONNECTICUT, COUNTRY: UNITED STATES
NAME: CHURCH STREET BREWING COMPANY, CITY: ITASCA, STATE: ILLINOIS, COUNTRY: UNITED STATES
NAME: CIBOLO CREEK BREWING CO., CITY: BOERNE, STATE: TEXAS, COUNTRY: UNITED STATES
NAME: CICLOPS CYDERI AND BREWERY, CITY: SPARTANBURG, STATE: SOUTH CAROLINA, COUNTRY: UNITED STATES
NAME: CIGAR CITY AIRPORT LOCATION, CITY: TAMPA, STATE: FLORIDA, COUNTRY: UNITED STATES
NAME: CIGAR CITY BREWING CO, CITY: TAMPA, STATE: FLORIDA, COUNTRY: UNITED STATES
NAME: CINCO CHAGAS, CITY: ANADIA, STATE: AVEIRO, COUNTRY: PORTUGAL
NAME: CINDER BLOCK BREWERY, CITY: NORTH KANSAS CITY, STATE: MISSOURI, COUNTRY: UNITED STATES
NAME: CINDERLANDS BEER CO., CITY: PITTSBURGH, STATE: PENNSYLVANIA, COUNTRY: UNITED STATES
NAME: CIRCA BREWING CO, CITY: BROOKLYN, STATE: NEW YORK, COUNTRY: UNITED STATES
NAME: CIRCLE 7 BREW WORKS, CITY: MONROE, STATE: WASHINGTON, COUNTRY: UNITED STATES
NAME: CIRCLE 9 BREWING, CITY: SAN DIEGO, STATE: CALIFORNIA, COUNTRY: UNITED STATES
NAME: CIRCLE 9 BREWING, CITY: SAN DIEGO, STATE: CALIFORNIA, COUNTRY: UNITED STATES
NAME: CIRCLE BREWING COMPANY, CITY: AUSTIN, STATE: TEXAS, COUNTRY: UNITED STATES
NAME: CISCO BREWERS, CITY: NANTUCKET, STATE: MASSACHUSETTS, COUNTRY: UNITED STATES
NAME: CISMONTANE BREWING CO, CITY: SANTA ANA, STATE: CALIFORNIA, COUNTRY: UNITED STATES
NAME: CITIZEN BREWERS, CITY: SAN DIEGO, STATE: CALIFORNIA, COUNTRY: UNITED STATES
NAME: CITY ACRE BREWING CO, CITY: HOUSTON, STATE: TEXAS, COUNTRY: UNITED STATES
NAME: CITY BARREL BREWING + KITCHEN, CITY: KANSAS CITY, STATE: MISSOURI, COUNTRY: UNITED STATES
NAME: CITY BREWING CO, CITY: LA CROSSE, STATE: WISCONSIN, COUNTRY: UNITED STATES
NAME: CITY BUILT BREWING COMPANY, CITY: GRAND RAPIDS, STATE: MICHIGAN, COUNTRY: UNITED STATES
NAME: CITY LIGHTS BREWING CO., CITY: MILWAUKEE, STATE: WISCONSIN, COUNTRY: UNITED STATES
NAME: CITY SERVICE BREWING, CITY: DARLINGTON, STATE: WISCONSIN, COUNTRY: UNITED STATES
NAME: CITY STAR BREWING, CITY: BERTHOUD, STATE: COLORADO, COUNTRY: UNITED STATES
NAME: CITY STEAM BREWERY, CITY: HARTFORD, STATE: CONNECTICUT, COUNTRY: UNITED STATES
NAME: CITY-STATE BREWING COMPANY, CITY: WASHINGTON, STATE: DISTRICT OF COLUMBIA, COUNTRY: UNITED STATES
NAME: CIVIL LIFE BREWING COMPANY, CITY: SAINT LOUIS, STATE: MISSOURI, COUNTRY: UNITED STATES
NAME: CIVIL SOCIETY BREWING CO, CITY: JUPITER, STATE: FLORIDA, COUNTRY: UNITED STATES
NAME: CIVILIAN BREWING CORPS, CITY: BLOOMINGTON, STATE: INDIANA, COUNTRY: UNITED STATES
NAME: CJS BREWING CO, CITY: COMMERCE TOWNSHIP, STATE: MICHIGAN, COUNTRY: UNITED STATES
NAME: CL RIVER OUTPOST BREWING, CITY: PEEKSKILL, STATE: NEW YORK, COUNTRY: UNITED STATES
NAME: CLAIM 52 BREWING, CITY: EUGENE, STATE: OREGON, COUNTRY: UNITED STATES
NAME: CLAIMSTAKE BREWING COMPANY, CITY: RANCHO CORDOVA, STATE: CALIFORNIA, COUNTRY: UNITED STATES
NAME: CLAIRVOYANT BREWING - BOISE, CITY: BOISE, STATE: IDAHO, COUNTRY: UNITED STATES
NAME: CLAIRVOYANT BREWING - WEST, CITY: GARDEN CITY, STATE: IDAHO, COUNTRY: UNITED STATES
NAME: CLAM LAKE BEER CO, CITY: CADILLAC, STATE: MICHIGAN, COUNTRY: UNITED STATES
NAME: CLANDESTINE BREWING, CITY: SAN JOSE, STATE: CALIFORNIA, COUNTRY: UNITED STATES
NAME: CLAREMONT CRAFT ALES, CITY: CLAREMONT, STATE: CALIFORNIA, COUNTRY: UNITED STATES
NAME: CLARION RIVER BREWING COMPANY, CITY: CLARION, STATE: PENNSYLVANIA, COUNTRY: UNITED STATES
NAME: CLAYTON BREWING CO, CITY: SAN DIMAS, STATE: CALIFORNIA, COUNTRY: UNITED STATES
NAME: CLE BREWING, CITY: MENTOR, STATE: OHIO, COUNTRY: UNITED STATES
NAME: CLEMSON BROS. BREWERY, CITY: MIDDLETOWN, STATE: NEW YORK, COUNTRY: UNITED STATES
NAME: CLEOPHUS QUEALY BEER COMPANY, CITY: SAN LEANDRO, STATE: CALIFORNIA, COUNTRY: UNITED STATES
NAME: CLERMONT BREWING COMPANY, CITY: CLERMONT, STATE: FLORIDA, COUNTRY: UNITED STATES
NAME: CLEVELAND BREWING COMPANY @ BUTCHER AND THE BREWER, CITY: CLEVELAND, STATE: OHIO, COUNTRY: UNITED STATES
NAME: CLIFFSIDE BREWING, CITY: WALLINGFORD, STATE: CONNECTICUT, COUNTRY: UNITED STATES
NAME: CLIMATE CITY BREWING CO., CITY: GRANTS PASS, STATE: OREGON, COUNTRY: UNITED STATES
NAME: CLIMAX BREWING CO, CITY: ROSELLE PARK, STATE: NEW JERSEY, COUNTRY: UNITED STATES
NAME: CLIMBER NINE BREWING, CITY: CAMERON PARK, STATE: CALIFORNIA, COUNTRY: UNITED STATES
NAME: CLIMBING BINES CRAFT ALE COMPANY, CITY: PENN YAN, STATE: NEW YORK, COUNTRY: UNITED STATES
NAME: CLINCH RIVER BREWING, CITY: NORRIS, STATE: TENNESSEE, COUNTRY: UNITED STATES
NAME: CLOCK HOUSE BREWING, CITY: CEDAR RAPIDS, STATE: IOWA, COUNTRY: UNITED STATES
NAME: CLOCKWERKS BREWING, CITY: MINNEAPOLIS, STATE: MINNESOTA, COUNTRY: UNITED STATES
NAME: CLOUD 9 BREWERY, CITY: BOISE, STATE: IDAHO, COUNTRY: UNITED STATES
NAME: CLOUDBURST BREWING, CITY: SEATTLE, STATE: WASHINGTON, COUNTRY: UNITED STATES
NAME: CLOUDBURST BREWING ON SHILSHOLE, CITY: SEATTLE, STATE: WASHINGTON, COUNTRY: UNITED STATES
NAME: CLOUDS BREWING, CITY: RALEIGH, STATE: NORTH CAROLINA, COUNTRY: UNITED STATES
NAME: CLOVERDALE ALE COMPANY'S RUTH MCGOWAN'S BREWPUB, CITY: CLOVERDALE, STATE: CALIFORNIA, COUNTRY: UNITED STATES
NAME: CLUBHOUSE BREWING COMPANY LTD, CITY: WARREN, STATE: OHIO, COUNTRY: UNITED STATES
NAME: CNB BREWPUB, CITY: SARASOTA, STATE: FLORIDA, COUNTRY: UNITED STATES
NAME: CO-BREW, CITY: DENVER, STATE: COLORADO, COUNTRY: UNITED STATES
NAME: COACHELLA VALLEY BREWING CO, CITY: THOUSAND PALMS, STATE: CALIFORNIA, COUNTRY: UNITED STATES
NAME: COAL COUNTRY BREWING, CITY: EBENSBURG, STATE: PENNSYLVANIA, COUNTRY: UNITED STATES
NAME: COAL CREEK TAP, CITY: LARAMIE, STATE: WYOMING, COUNTRY: UNITED STATES
NAME: COAL MINE AVE BREWING COMPANY, CITY: LITTLETON, STATE: COLORADO, COUNTRY: UNITED STATES
NAME: COAL TIPPLE BREWERY / KRAMER FARMS, CITY: BURGETTSTOWN, STATE: PENNSYLVANIA, COUNTRY: UNITED STATES
NAME: COALITION BREWING CO, CITY: PORTLAND, STATE: OREGON, COUNTRY: UNITED STATES
NAME: COAST BREWING CO, CITY: NORTH CHARLESTON, STATE: SOUTH CAROLINA, COUNTRY: UNITED STATES
NAME: COASTAL BEND BREWING, CITY: CORPUS CHRISTI, STATE: TEXAS, COUNTRY: UNITED STATES
NAME: COASTAL EMPIRE BEER CO, CITY: SAVANNAH, STATE: GEORGIA, COUNTRY: UNITED STATES
NAME: COASTAL STAR BREWING COMPANY, CITY: SANTA MARIA, STATE: CALIFORNIA, COUNTRY: UNITED STATES
NAME: COBBLEHAUS BREWING COMPANY, CITY: CORAOPOLIS, STATE: PENNSYLVANIA, COUNTRY: UNITED STATES
NAME: COCOA BEACH BREWING CO, CITY: COCOA BEACH, STATE: FLORIDA, COUNTRY: UNITED STATES
NAME: CODA BREWING COMPANY, CITY: GOLDEN, STATE: COLORADO, COUNTRY: UNITED STATES
NAME: CODDINGTON BREWING CO, CITY: MIDDLETOWN, STATE: RHODE ISLAND, COUNTRY: UNITED STATES
NAME: CODE BEER CO., CITY: LINCOLN, STATE: NEBRASKA, COUNTRY: UNITED STATES
NAME: COELACANTH BREWING, CITY: NORFOLK, STATE: VIRGINIA, COUNTRY: UNITED STATES
NAME: COGNITION BREWING COMPANY, CITY: ISHPEMING, STATE: MICHIGAN, COUNTRY: UNITED STATES
NAME: COGNITO BREWING COMPANY, CITY: BANGOR, STATE: MICHIGAN, COUNTRY: UNITED STATES
NAME: COGSTONE BREWING CO, CITY: COLORADO SPRINGS, STATE: COLORADO, COUNTRY: UNITED STATES
NAME: COHORT CRAFT BREWERY, CITY: RAPID CITY, STATE: SOUTH DAKOTA, COUNTRY: UNITED STATES
NAME: COIN TOSS BREWING CO, CITY: OREGON CITY, STATE: OREGON, COUNTRY: UNITED STATES
NAME: COLD CRASH BREWING, CITY: SEATTLE, STATE: WASHINGTON, COUNTRY: UNITED STATES
NAME: COLD CREEK BREWERY, CITY: ELLINGTON, STATE: CONNECTICUT, COUNTRY: UNITED STATES
NAME: COLD FUSION BREWING LLC, CITY: KNOXVILLE, STATE: TENNESSEE, COUNTRY: UNITED STATES
NAME: COLD HARBOR BREWING COMPANY, CITY: WESTBOROUGH, STATE: MASSACHUSETTS, COUNTRY: UNITED STATES
NAME: COLD IRON BREWING, CITY: IRONWOOD, STATE: MICHIGAN, COUNTRY: UNITED STATES
NAME: COLD SPRING BREWERY, CITY: CAPE MAY, STATE: NEW JERSEY, COUNTRY: UNITED STATES
NAME: COLD WATER BREWERY AND GRILL, CITY: SOUTH LAKE TAHOE, STATE: CALIFORNIA, COUNTRY: UNITED STATES
NAME: COLDFIRE BREWING, CITY: EUGENE, STATE: OREGON, COUNTRY: UNITED STATES
NAME: COLE STREET BREWERY, CITY: ENUMCLAW, STATE: WASHINGTON, COUNTRY: UNITED STATES
NAME: COLES ROAD BREWING, CITY: CROMWELL, STATE: CONNECTICUT, COUNTRY: UNITED STATES
NAME: COLFAX ALE CELLAR, CITY: RATON, STATE: NEW MEXICO, COUNTRY: UNITED STATES
NAME: COLLECTION BREWING COMPANY, CITY: RALEIGH, STATE: NORTH CAROLINA, COUNTRY: UNITED STATES
NAME: COLLEGE POINT BREWERY, CITY: COLLEGE POINT, STATE: NEW YORK, COUNTRY: UNITED STATES
NAME: COLLEGE STREET BREWHOUSE AND PUB, CITY: LAKE HAVASU CITY, STATE: ARIZONA, COUNTRY: UNITED STATES
NAME: COLLISION BEND BREWING CO, CITY: CLEVELAND, STATE: OHIO, COUNTRY: UNITED STATES
NAME: COLLUDIUM BREWERY, CITY: HATTIESBURG, STATE: MISSISSIPPI, COUNTRY: UNITED STATES
NAME: COLLUSION TAP WORKS, CITY: YORK, STATE: PENNSYLVANIA, COUNTRY: UNITED STATES
NAME: COLONSAY ALES, CITY: ISLE OF COLONSAY, STATE: ARGYLL, COUNTRY: SCOTLAND
NAME: COLORADO BOY PIZZERIA, CITY: MONTROSE, STATE: COLORADO, COUNTRY: UNITED STATES
NAME: COLORADO BOY PUB & BREWERY, CITY: RIDGWAY, STATE: COLORADO, COUNTRY: UNITED STATES
NAME: COLORADO FARM BREWERY, CITY: ALAMOSA, STATE: COLORADO, COUNTRY: UNITED STATES
NAME: COLORADO MOUNTAIN BREWERY, CITY: COLORADO SPRINGS, STATE: COLORADO, COUNTRY: UNITED STATES
NAME: COLORADO MOUNTAIN BREWERY AT THE ROUNDHOUSE, CITY: COLORADO SPRINGS, STATE: COLORADO, COUNTRY: UNITED STATES
NAME: COLORADO PLUS, CITY: WHEAT RIDGE, STATE: COLORADO, COUNTRY: UNITED STATES
NAME: COLUMBIA CRAFT BREWING COMPANY, CITY: COLUMBIA, STATE: SOUTH CAROLINA, COUNTRY: UNITED STATES
NAME: COLUMBIA KETTLE WORKS, CITY: COLUMBIA, STATE: PENNSYLVANIA, COUNTRY: UNITED STATES
NAME: COLUMBIA RIVER BREWING CO, CITY: PORTLAND, STATE: OREGON, COUNTRY: UNITED STATES
NAME: COLUMBIA VALLEY BREWING, CITY: WENATCHEE, STATE: WASHINGTON, COUNTRY: UNITED STATES
NAME: COLUMBUS BREWING CO, CITY: COLUMBUS, STATE: OHIO, COUNTRY: UNITED STATES
NAME: COLUMBUS HOUSE BREWERY, CITY: FAYETTEVILLE, STATE: ARKANSAS, COUNTRY: UNITED STATES
NAME: COMANCHE CREEK BREWING CO, CITY: EAGLE NEST, STATE: NEW MEXICO, COUNTRY: UNITED STATES
NAME: COMBUSTION BREWERY, CITY: PICKERINGTON, STATE: OHIO, COUNTRY: UNITED STATES
NAME: COMMON BLOCK BREWING COMPANY, CITY: MEDFORD, STATE: OREGON, COUNTRY: UNITED STATES
NAME: COMMON BOND BREWERS, LLC, CITY: MONTGOMERY, STATE: ALABAMA, COUNTRY: UNITED STATES
NAME: COMMON JOHN BREWING CO, CITY: MANCHESTER, STATE: TENNESSEE, COUNTRY: UNITED STATES
NAME: COMMON ROOTS BREWING COMPANY, CITY: SOUTH GLENS FALLS, STATE: NEW YORK, COUNTRY: UNITED STATES
NAME: COMMON SENSE BREWING, CITY: BORDENTOWN, STATE: NEW JERSEY, COUNTRY: UNITED STATES
NAME: COMMON SPACE BREWERY, CITY: HAWTHORNE, STATE: CALIFORNIA, COUNTRY: UNITED STATES
NAME: COMMONERS BREWING COMPANY, CITY: CONCORD, STATE: NORTH CAROLINA, COUNTRY: UNITED STATES
NAME: COMMONHOUSE ALES, CITY: COLUMBUS, STATE: OHIO, COUNTRY: UNITED STATES
NAME: COMMONHOUSE ALEWORKS, CITY: NORTH CHARLESTON, STATE: SOUTH CAROLINA, COUNTRY: UNITED STATES
NAME: COMMONWEALTH BREWING CO., CITY: VIRGINIA BEACH, STATE: VIRGINIA, COUNTRY: UNITED STATES
NAME: COMMUNITY BEER CO, CITY: DALLAS, STATE: TEXAS, COUNTRY: UNITED STATES
NAME: COMMUNITY BEER WORKS, CITY: BUFFALO, STATE: NEW YORK, COUNTRY: UNITED STATES
NAME: COMPADRE BREWING, CITY: AOUND ROCK, STATE: TEXAS, COUNTRY: UNITED STATES
NAME: COMPANY BREWING CO, CITY: MILWAUKEE, STATE: WISCONSIN, COUNTRY: UNITED STATES
NAME: COMPASS ROSE, CITY: RALEIGH, STATE: NORTH CAROLINA, COUNTRY: UNITED STATES
NAME: COMPONENT BREWING CO, CITY: MILWAUKEE, STATE: WISCONSIN, COUNTRY: UNITED STATES
NAME: COMRADE BREWING COMPANY, CITY: DENVER, STATE: COLORADO, COUNTRY: UNITED STATES
NAME: CONCLAVE BREWING, CITY: FLEMINGTON, STATE: NEW JERSEY, COUNTRY: UNITED STATES
NAME: CONCORD CRAFT BREWERY, CITY: CONCORD, STATE: NEW HAMPSHIRE, COUNTRY: UNITED STATES
NAME: CONCRETE BEACH BREWERY, CITY: MIAMI, STATE: FLORIDA, COUNTRY: UNITED STATES
NAME: CONEY ISLAND BEER, CITY: BROOKLYN, STATE: NEW YORK, COUNTRY: UNITED STATES
NAME: CONFLUENCE BREWING CO, CITY: DES MOINES, STATE: IOWA, COUNTRY: UNITED STATES
NAME: CONFLUX BREWING, CITY: MISSOULA, STATE: MONTANA, COUNTRY: UNITED STATES
NAME: CONFLUXCITY BREWING COMPANY, CITY: PORTLAND, STATE: MICHIGAN, COUNTRY: UNITED STATES
NAME: CONGREGATION ALES, CITY: AZUSA, STATE: CALIFORNIA, COUNTRY: UNITED STATES
NAME: CONNECTICUT VALLEY BREWING COMPANY, CITY: SOUTH WINDSOR, STATE: CONNECTICUT, COUNTRY: UNITED STATES
NAME: CONNER FIELDS BREWING, CITY: GRANTS PASS, STATE: OREGON, COUNTRY: UNITED STATES
NAME: CONNY CREEK BREWING CO, CITY: NEW KENSINGTON, STATE: PENNSYLVANIA, COUNTRY: UNITED STATES
NAME: CONQUEST BREWING CO., CITY: COLUMBIA, STATE: SOUTH CAROLINA, COUNTRY: UNITED STATES
NAME: CONSHOHOCKEN BREWING - BRIDGEPORT, CITY: BRIDGEPORT, STATE: PENNSYLVANIA, COUNTRY: UNITED STATES
NAME: CONSHOHOCKEN BREWING CO., CITY: CONSHOHOCKEN, STATE: PENNSYLVANIA, COUNTRY: UNITED STATES
NAME: CONSTANTINE BREWING CO, CITY: CONSTANTINE, STATE: MICHIGAN, COUNTRY: UNITED STATES
NAME: CONSTELLATION BRANDS, CITY: SAN DIEGO, STATE: CALIFORNIA, COUNTRY: UNITED STATES
NAME: CONTRARY BREWING CO, CITY: MUSCATINE, STATE: IOWA, COUNTRY: UNITED STATES
NAME: CONVERGE BREWING COMPANY, CITY: PASO ROBLES, STATE: CALIFORNIA, COUNTRY: UNITED STATES
NAME: CONVERSATIONS BREWING, CITY: BATTLE GROUND, STATE: WASHINGTON, COUNTRY: UNITED STATES
NAME: CONVERSION BREWING, CITY: LEBANON, STATE: OREGON, COUNTRY: UNITED STATES
NAME: CONYNGHAM BREWING COMPANY, CITY: CONYNGHAM, STATE: PENNSYLVANIA, COUNTRY: UNITED STATES
NAME: COOL BEERWERKS, CITY: COOL, STATE: CALIFORNIA, COUNTRY: UNITED STATES
NAME: COOL SPRINGS BREWERY, CITY: FRANKLIN, STATE: TENNESSEE, COUNTRY: UNITED STATES
NAME: COOLING POND BREWERY, CITY: MINERAL, STATE: VIRGINIA, COUNTRY: UNITED STATES
NAME: COOP ALE WORKS, CITY: OKLAHOMA CITY, STATE: OKLAHOMA, COUNTRY: UNITED STATES
NAME: COOPER LANDING BREWING COMPANY, CITY: COOPER LANDING, STATE: ALASKA, COUNTRY: UNITED STATES
NAME: COOPER MOUNTAIN ALE WORKS, CITY: BEAVERTON, STATE: OREGON, COUNTRY: UNITED STATES
NAME: COOPER RIVER BREWING COMPANY, CITY: CHARLESTON, STATE: SOUTH CAROLINA, COUNTRY: UNITED STATES
NAME: COOPERAGE BREWING CO., CITY: SANTA ROSA, STATE: CALIFORNIA, COUNTRY: UNITED STATES
NAME: COOPERS CAVE ALE CO, CITY: GLENS FALLS, STATE: NEW YORK, COUNTRY: UNITED STATES
NAME: COOPERSMITHS PUB AND BREWING, CITY: FORT COLLINS, STATE: COLORADO, COUNTRY: UNITED STATES
NAME: COOPERSTOWN BREWING CO, CITY: ONEONTA, STATE: NEW YORK, COUNTRY: UNITED STATES
NAME: COPP BREWERY & WINERY, CITY: CRYSTAL RIVER, STATE: FLORIDA, COUNTRY: UNITED STATES
NAME: COPPER BROTHEL BREWERY, CITY: SONOITA, STATE: ARIZONA, COUNTRY: UNITED STATES
NAME: COPPER CITY BREWING COMPANY, CITY: ROME, STATE: NEW YORK, COUNTRY: UNITED STATES
NAME: COPPER CLUB BREWING CO, CITY: FRUITA, STATE: COLORADO, COUNTRY: UNITED STATES
NAME: COPPER KETTLE BREWING CO, CITY: PITTSBURGH, STATE: PENNSYLVANIA, COUNTRY: UNITED STATES
NAME: COPPER KETTLE BREWING COMPANY, CITY: DENVER, STATE: COLORADO, COUNTRY: UNITED STATES
NAME: COPPER MINE BREWING CO, CITY: TUCSON, STATE: ARIZONA, COUNTRY: UNITED STATES
NAME: COPPER STATE BREWING CO, CITY: GREEN BAY, STATE: WISCONSIN, COUNTRY: UNITED STATES
NAME: COPPER TRAIL BREWING CO., CITY: ALEXANDRIA, STATE: MINNESOTA, COUNTRY: UNITED STATES
NAME: COPPER TURRET RESTAURANT AND BREWHOUSE, CITY: MORRISVILLE, STATE: NEW YORK, COUNTRY: UNITED STATES
NAME: COPPERHEAD BREWERY, CITY: CONROE, STATE: TEXAS, COUNTRY: UNITED STATES
NAME: COPPERPOINT BREWING COMPANY, CITY: BOYNTON BEACH, STATE: FLORIDA, COUNTRY: UNITED STATES
NAME: COPPERTAIL BREWING, CITY: TAMPA, STATE: FLORIDA, COUNTRY: UNITED STATES
NAME: COPPERTOP ALEHOUSE AND STILL WORKS, CITY: PRESCOTT, STATE: ARIZONA, COUNTRY: UNITED STATES
NAME: CORBETT BREWING COMPANY, CITY: TUCSON, STATE: ARIZONA, COUNTRY: UNITED STATES
NAME: CORCORAN BREWING, CITY: PURCELLVILLE, STATE: VIRGINIA, COUNTRY: UNITED STATES
NAME: CORE BREWING - HOT SPRINGS, CITY: HOT SPRINGS NATIONAL PARK, STATE: ARKANSAS, COUNTRY: UNITED STATES
NAME: CORE BREWING - SOMA, CITY: LITTLE ROCK, STATE: ARKANSAS, COUNTRY: UNITED STATES
NAME: CORE BREWING & DISTILLING CO, CITY: SPRINGDALE, STATE: ARKANSAS, COUNTRY: UNITED STATES
NAME: CORNER PUB, CITY: REEDSBURG, STATE: WISCONSIN, COUNTRY: UNITED STATES
NAME: CORNERSTONE BREWING CO, CITY: BEREA, STATE: OHIO, COUNTRY: UNITED STATES
NAME: CORNERSTONE BREWING CO, CITY: MADISON, STATE: OHIO, COUNTRY: UNITED STATES
NAME: CORONADO BREWING CO, CITY: CORONADO, STATE: CALIFORNIA, COUNTRY: UNITED STATES
NAME: CORONADO BREWING CO - PRODUCTION FACILITY, CITY: SAN DIEGO, STATE: CALIFORNIA, COUNTRY: UNITED STATES
NAME: CORRALES BISTRO BREWERY, CITY: CORRALES, STATE: NEW MEXICO, COUNTRY: UNITED STATES
NAME: CORRALITOS BREWING CO, CITY: WATSONVILLE, STATE: CALIFORNIA, COUNTRY: UNITED STATES
NAME: CORRIDOR BREWERY & PROVISIONS, CITY: CHICAGO, STATE: ILLINOIS, COUNTRY: UNITED STATES
NAME: CORSAIR ARTISAN LLC, CITY: NASHVILLE, STATE: TENNESSEE, COUNTRY: UNITED STATES
NAME: CORTLAND BEER COMPANY, CITY: CORTLAND, STATE: NEW YORK, COUNTRY: UNITED STATES
NAME: COSMIC BREWERY, CITY: TORRANCE, STATE: CALIFORNIA, COUNTRY: UNITED STATES
NAME: COSMIC EYE BREWING, CITY: LINCOLN, STATE: NEBRASKA, COUNTRY: UNITED STATES
NAME: COSMOS BREWING, CITY: HUGO, STATE: MINNESOTA, COUNTRY: UNITED STATES
NAME: COSTA VENTOSA WINERY & VINEYARD, CITY: WHALEYVILLE, STATE: MARYLAND, COUNTRY: UNITED STATES
NAME: COSTAR BREWING INC., CITY: PITTSBURGH, STATE: PENNSYLVANIA, COUNTRY: UNITED STATES
NAME: COSTELLOS BREWING COMPANY, CITY: KILKENNY, STATE: KILKENNY, COUNTRY: IRELAND
NAME: COTEE RIVER BREWING COMPANY, CITY: NEW PORT RICHEY, STATE: FLORIDA, COUNTRY: UNITED STATES
NAME: COTTON BALL BREWING COMPANY, CITY: MAYFIELD, STATE: CORK, COUNTRY: IRELAND
NAME: COTTON BREWING CO, CITY: ADRIAN, STATE: MICHIGAN, COUNTRY: UNITED STATES
NAME: COTTONTOWN BREW LAB, CITY: COLUMBIA, STATE: SOUTH CAROLINA, COUNTRY: UNITED STATES
NAME: COTTRELL BREWING CO, CITY: PAWCATUCK, STATE: CONNECTICUT, COUNTRY: UNITED STATES
NAME: COUCH BREWERY, CITY: PITTSBURGH, STATE: PENNSYLVANIA, COUNTRY: UNITED STATES
NAME: COUNCIL BREWING - MAGIC FACTORY, CITY: SAN DIEGO, STATE: CALIFORNIA, COUNTRY: UNITED STATES
NAME: COUNCIL BREWING COMPANY, CITY: SAN DIEGO, STATE: CALIFORNIA, COUNTRY: UNITED STATES
NAME: COUNCIL BREWING COMPANY, CITY: SANTEE, STATE: CALIFORNIA, COUNTRY: UNITED STATES
NAME: COUNCIL ROCK BREWERY, CITY: COOPERSTOWN, STATE: NEW YORK, COUNTRY: UNITED STATES
NAME: COUNTERBALANCE BREWING COMPANY, CITY: SEATTLE, STATE: WASHINGTON, COUNTRY: UNITED STATES
NAME: COUNTERWEIGHT BREWING COMPANY, CITY: HAMDEN, STATE: CONNECTICUT, COUNTRY: UNITED STATES
NAME: COUNTRY BOY BREWING, CITY: LEXINGTON, STATE: KENTUCKY, COUNTRY: UNITED STATES
NAME: COUNTRY BOY BREWING - GEORGETOWN, CITY: GEORGETOWN, STATE: KENTUCKY, COUNTRY: UNITED STATES
NAME: COUNTRY TOWN FARM BREWERY, CITY: FRIENDSHIP, STATE: NEW YORK, COUNTRY: UNITED STATES
NAME: COUNTY LINE BREWING, CITY: GARDEN CITY, STATE: IDAHO, COUNTRY: UNITED STATES
NAME: COURT AVENUE BREWING CO, CITY: DES MOINES, STATE: IOWA, COUNTRY: UNITED STATES
NAME: COURTHOUSE PUB, CITY: MANITOWOC, STATE: WISCONSIN, COUNTRY: UNITED STATES
NAME: COUSINS REVOLUTION ALE WORKS, CITY: WAPPINGERS FALLS, STATE: NEW YORK, COUNTRY: UNITED STATES
NAME: COVERED BRIDGE BREWHAUS TAPROOM, CITY: SHAMOKIN, STATE: PENNSYLVANIA, COUNTRY: UNITED STATES
NAME: COVERT ARTISAN ALES & CELLARS, CITY: SIOUX FALLS, STATE: SOUTH DAKOTA, COUNTRY: UNITED STATES
NAME: COVINGTON BREWHOUSE, CITY: COVINGTON, STATE: LOUISIANA, COUNTRY: UNITED STATES
NAME: COWBOY STATE BREWING, CITY: GLENROCK, STATE: WYOMING, COUNTRY: UNITED STATES
NAME: COWICHE CREEK BREWING COMPANY, CITY: COWICHE, STATE: WASHINGTON, COUNTRY: UNITED STATES
NAME: COWTOWN BREWING COMPANY, CITY: FORT WORTH, STATE: TEXAS, COUNTRY: UNITED STATES
NAME: CR BREWING COMPANY, CITY: NEW CASTLE, STATE: PENNSYLVANIA, COUNTRY: UNITED STATES
NAME: CRABTREE BREWING, CITY: GREELEY, STATE: COLORADO, COUNTRY: UNITED STATES
NAME: CRAFT 64, CITY: SCOTTSDALE, STATE: ARIZONA, COUNTRY: UNITED STATES
NAME: CRAFT ARTISAN ALES, CITY: PACIFIC GROVE, STATE: CALIFORNIA, COUNTRY: UNITED STATES
NAME: CRAFT BREWING COMPANY, CITY: LAKE ELSINORE, STATE: CALIFORNIA, COUNTRY: UNITED STATES
NAME: CRAFT KITCHEN AND BREWERY, CITY: BEND, STATE: OREGON, COUNTRY: UNITED STATES
NAME: CRAFT LIFE BREWING, CITY: LAND O LAKES, STATE: FLORIDA, COUNTRY: UNITED STATES
NAME: CRAFTHAUS BREWERY, CITY: HENDERSON, STATE: NEVADA, COUNTRY: UNITED STATES
NAME: CRAFTROOT, CITY: SOKCHO-SI, STATE: GANGWONDO, COUNTRY: SOUTH KOREA
NAME: CRAFTROOTS BREWING, LLC., CITY: MILFORD, STATE: MASSACHUSETTS, COUNTRY: UNITED STATES
NAME: CRAFTSMAN BREWING CO, CITY: PASADENA, STATE: CALIFORNIA, COUNTRY: UNITED STATES
NAME: CRAFTWERK ORANGE BREWING COMPANY, CITY: WEST ORANGE, STATE: NEW JERSEY, COUNTRY: UNITED STATES
NAME: CRAFTY ALES AND LAGERS, CITY: PHELPS, STATE: NEW YORK, COUNTRY: UNITED STATES
NAME: CRAFTY BASTARD BREWERY, CITY: KNOXVILLE, STATE: TENNESSEE, COUNTRY: UNITED STATES
NAME: CRANE BREWING COMPANY, CITY: RAYTOWN, STATE: MISSOURI, COUNTRY: UNITED STATES
NAME: CRANE'S CASTLE BREWING, CITY: BREMERTON, STATE: WASHINGTON, COUNTRY: UNITED STATES
NAME: CRANK ARM BREWING CO, CITY: RALEIGH, STATE: NORTH CAROLINA, COUNTRY: UNITED STATES
NAME: CRANKER'S BREWERY, CITY: BIG RAPIDS, STATE: MICHIGAN, COUNTRY: UNITED STATES
NAME: CRANKER'S RESTAURANT & BREWERY, CITY: GRAND RAPIDS, STATE: MICHIGAN, COUNTRY: UNITED STATES
NAME: CRANKER'S RESTAURANT & BREWERY, CITY: MOUNT PLEASANT, STATE: MICHIGAN, COUNTRY: UNITED STATES
NAME: CRASIAN BREWING CO, CITY: BROOKSTON, STATE: INDIANA, COUNTRY: UNITED STATES
NAME: CRAVINGS BISTRO & PUB, CITY: BENTON HARBOR, STATE: MICHIGAN, COUNTRY: UNITED STATES
NAME: CRAWFORD BREW WORKS, CITY: BETTENDORF, STATE: IOWA, COUNTRY: UNITED STATES
NAME: CRAZY MOUNTAIN BREWING CO, CITY: DENVER, STATE: COLORADO, COUNTRY: UNITED STATES
NAME: CRAZY WILLIEZ BREWERY, CITY: ILION, STATE: NEW YORK, COUNTRY: UNITED STATES
NAME: CREATURE COMFORTS BREWING CO., CITY: ATHENS, STATE: GEORGIA, COUNTRY: UNITED STATES
NAME: CREATURE COMFORTS PRODUCTION FACILITY AT SOUTHERN MILL, CITY: ATHENS, STATE: GEORGIA, COUNTRY: UNITED STATES
NAME: CREATURES OF HABIT BREWING CO, CITY: ANDERSON, STATE: INDIANA, COUNTRY: UNITED STATES
NAME: CREEK BOTTOM BREW LLC, CITY: OLDENBURG, STATE: INDIANA, COUNTRY: UNITED STATES
NAME: CREEK BOTTOM BREWING, CITY: GALAX, STATE: VIRGINIA, COUNTRY: UNITED STATES
NAME: CRESCENT BREWERY, CITY: NAMPA, STATE: IDAHO, COUNTRY: UNITED STATES
NAME: CRESCENT CITY BREWHOUSE, CITY: NEW ORLEANS, STATE: LOUISIANA, COUNTRY: UNITED STATES
NAME: CRESTON BREWERY, CITY: GRAND RAPIDS, STATE: MICHIGAN, COUNTRY: UNITED STATES
NAME: CRESTONE BREWING COMPANY, CITY: CRESTONE, STATE: COLORADO, COUNTRY: UNITED STATES
NAME: CREW BREWING COMPANY, CITY: LIMERICK, STATE: LIMERICK, COUNTRY: IRELAND
NAME: CRICKET HILL BREWING CO. INC., CITY: FAIRFIELD, STATE: NEW JERSEY, COUNTRY: UNITED STATES
NAME: CRIME & PUNISHMENT BREWING COMPANY, CITY: PHILADELPHIA, STATE: PENNSYLVANIA, COUNTRY: UNITED STATES
NAME: CRISIS BREWING LLC, CITY: FAYETTEVILLE, STATE: ARKANSAS, COUNTRY: UNITED STATES
NAME: CRITZ FARMS BREWING & CIDER CO., CITY: CAZENOVIA, STATE: NEW YORK, COUNTRY: UNITED STATES
NAME: CROOKED CAN BREWING CO, CITY: WINTER GARDEN, STATE: FLORIDA, COUNTRY: UNITED STATES
NAME: CROOKED CRAB BREWING COMPANY, CITY: ODENTON, STATE: MARYLAND, COUNTRY: UNITED STATES
NAME: CROOKED CURRENT BREWERY, CITY: PAWTUCKET, STATE: RHODE ISLAND, COUNTRY: UNITED STATES
NAME: CROOKED EWE BREWERY & ALE HOUSE, CITY: SOUTH BEND, STATE: INDIANA, COUNTRY: UNITED STATES
NAME: CROOKED EYE BREWERY, CITY: HATBORO, STATE: PENNSYLVANIA, COUNTRY: UNITED STATES
NAME: CROOKED FENCE BREWING, CITY: GARDEN CITY, STATE: IDAHO, COUNTRY: UNITED STATES
NAME: CROOKED FURROW BREWING, CITY: HELENA, STATE: MONTANA, COUNTRY: UNITED STATES
NAME: CROOKED GOAT BREWING, CITY: SEBASTOPOL, STATE: CALIFORNIA, COUNTRY: UNITED STATES
NAME: CROOKED HAMMOCK BREWERY, CITY: LEWES, STATE: DELAWARE, COUNTRY: UNITED STATES
NAME: CROOKED HANDLE BREWING CO., CITY: SPRINGBORO, STATE: OHIO, COUNTRY: UNITED STATES
NAME: CROOKED LABEL BREWING COMPANY, CITY: MONROE, STATE: WASHINGTON, COUNTRY: UNITED STATES
NAME: CROOKED LADDER BREWERY, CITY: RIVERHEAD, STATE: NEW YORK, COUNTRY: UNITED STATES
NAME: CROOKED LANE BREWING CO, CITY: AUBURN, STATE: CALIFORNIA, COUNTRY: UNITED STATES
NAME: CROOKED LETTER BREWING CO, CITY: OCEAN SPRINGS, STATE: MISSISSIPPI, COUNTRY: UNITED STATES
NAME: CROOKED PECKER BREWING, CITY: NEWBURY, STATE: OHIO, COUNTRY: UNITED STATES
NAME: CROOKED ROOSTER BREWERY LLC., CITY: MACCLENNY, STATE: FLORIDA, COUNTRY: UNITED STATES
NAME: CROOKED RUN BREWING, CITY: LEESBURG, STATE: VIRGINIA, COUNTRY: UNITED STATES
NAME: CROOKED STAVE ARTISAN BEER PROJECT, CITY: DENVER, STATE: COLORADO, COUNTRY: UNITED STATES
NAME: CROOKED THUMB BREWERY, CITY: SAFETY HARBOR, STATE: FLORIDA, COUNTRY: UNITED STATES
NAME: CROOKED TONGUE BREWING, CITY: EDINBURG, STATE: PENNSYLVANIA, COUNTRY: UNITED STATES
NAME: CROOKED TOOTH BREWING CO., CITY: TUCSON, STATE: ARIZONA, COUNTRY: UNITED STATES
NAME: CROSS COUNTRY BREWING, CITY: GLENDIVE, STATE: MONTANA, COUNTRY: UNITED STATES
