NAME: RADIO BREWING COMPANY, CITY: KELLOGG, STATE: IDAHO, COUNTRY: UNITED STATES
NAME: RADIUM CITY BREWING, CITY: OTTAWA, STATE: ILLINOIS, COUNTRY: UNITED STATES
NAME: RADIUS BREWING COMPANY, CITY: EMPORIA, STATE: KANSAS, COUNTRY: UNITED STATES
NAME: RAGGED ISLAND BREWING COMPANY, CITY: PORTSMOUTH, STATE: RHODE ISLAND, COUNTRY: UNITED STATES
NAME: RAGTIME TAVERN SEAFOOD AND GRILL, CITY: ATLANTIC BEACH, STATE: FLORIDA, COUNTRY: UNITED STATES
NAME: RAHR AND SONS BREWING CO, CITY: FORT WORTH, STATE: TEXAS, COUNTRY: UNITED STATES
NAME: RAHR TECHNICAL CENTER LLC, CITY: SHAKOPEE, STATE: MINNESOTA, COUNTRY: UNITED STATES
NAME: RAICES BREWING CO, CITY: DENVER, STATE: COLORADO, COUNTRY: UNITED STATES
NAME: RAIL HOP'N BREWING CO, CITY: AUBURN, STATE: WASHINGTON, COUNTRY: UNITED STATES
NAME: RAIL LINE BREWING, CITY: SIMPSONVILLE, STATE: SOUTH CAROLINA, COUNTRY: UNITED STATES
NAME: RAILHEAD BREWING COMPANY, CITY: HORNELL, STATE: NEW YORK, COUNTRY: UNITED STATES
NAME: RAILHOUSE BREWERY, CITY: ABERDEEN, STATE: NORTH CAROLINA, COUNTRY: UNITED STATES
NAME: RAILHOUSE RESTAURANT AND BREWERY, CITY: MARINETTE, STATE: WISCONSIN, COUNTRY: UNITED STATES
NAME: RAILPORT BREWING COMPANY, CITY: WAXAHACHIE, STATE: TEXAS, COUNTRY: UNITED STATES
NAME: RAILROAD BREWING COMPANY, CITY: AVON, STATE: OHIO, COUNTRY: UNITED STATES
NAME: RAILROAD CITY BREWING COMPANY, CITY: ALTOONA, STATE: PENNSYLVANIA, COUNTRY: UNITED STATES
NAME: RAILROAD SEAFOOD STATION & BREWING CO., CITY: CORPUS CHRISTI, STATE: TEXAS, COUNTRY: UNITED STATES
NAME: RAILS END BEER COMPANY, CITY: BROOMFIELD, STATE: COLORADO, COUNTRY: UNITED STATES
NAME: RAILSIDE BREWING, CITY: VANCOUVER, STATE: WASHINGTON, COUNTRY: UNITED STATES
NAME: RAILTOWN BREWING CO, CITY: DUTTON, STATE: MICHIGAN, COUNTRY: UNITED STATES
NAME: RAINTREE BREWING COMPANY, CITY: NEW HARMONY, STATE: INDIANA, COUNTRY: UNITED STATES
NAME: RAINY DAZE BREWING, CITY: POULSBO, STATE: WASHINGTON, COUNTRY: UNITED STATES
NAME: RAISED GRAIN BREWING COMPANY, CITY: WAUKESHA, STATE: WISCONSIN, COUNTRY: UNITED STATES
NAME: RALEIGH BREWING COMPANY, CITY: RALEIGH, STATE: NORTH CAROLINA, COUNTRY: UNITED STATES
NAME: RALLY KING BREWING, CITY: FORT COLLINS, STATE: COLORADO, COUNTRY: UNITED STATES
NAME: RAM RESTAURANT AND BREWERY - BOISE, CITY: BOISE, STATE: IDAHO, COUNTRY: UNITED STATES
NAME: RAM RESTAURANT AND BREWERY - CLACKAMAS, CITY: CLACKAMAS, STATE: OREGON, COUNTRY: UNITED STATES
NAME: RAM RESTAURANT AND BREWERY - INDIANAPOLIS, CITY: INDIANAPOLIS, STATE: INDIANA, COUNTRY: UNITED STATES
NAME: RAM RESTAURANT AND BREWERY - LAKEWOOD, CITY: LAKEWOOD, STATE: WASHINGTON, COUNTRY: UNITED STATES
NAME: RAM RESTAURANT AND BREWERY - MEDFORD, CITY: MEDFORD, STATE: OREGON, COUNTRY: UNITED STATES
NAME: RAM RESTAURANT AND BREWERY - PRODUCTION, CITY: TACOMA, STATE: WASHINGTON, COUNTRY: UNITED STATES
NAME: RAM RESTAURANT AND BREWERY - PUYALLUP SOUTH HILL, CITY: PUYALLUP, STATE: WASHINGTON, COUNTRY: UNITED STATES
NAME: RAM RESTAURANT AND BREWERY - SALEM, CITY: SALEM, STATE: OREGON, COUNTRY: UNITED STATES
NAME: RAM RESTAURANT AND BREWERY - SCHAUMBURG, CITY: SCHAUMBURG, STATE: ILLINOIS, COUNTRY: UNITED STATES
NAME: RAM RESTAURANT AND BREWERY - SEATTLE, CITY: SEATTLE, STATE: WASHINGTON, COUNTRY: UNITED STATES
NAME: RAM RESTAURANT AND BREWERY - TACOMA, CITY: TACOMA, STATE: WASHINGTON, COUNTRY: UNITED STATES
NAME: RAM RESTAURANT AND BREWERY - WHEELING, CITY: WHEELING, STATE: ILLINOIS, COUNTRY: UNITED STATES
NAME: RAM RESTAURANT AND BREWERY- NORTHGATE, CITY: SEATTLE, STATE: WASHINGTON, COUNTRY: UNITED STATES
NAME: RAMBLIN REDS BREWING COMPANY, CITY: WAUSEON, STATE: OHIO, COUNTRY: UNITED STATES
NAME: RAMSKELLER, CITY: FORT COLLINS, STATE: COLORADO, COUNTRY: UNITED STATES
NAME: RANCHO DE LOMI BREWING, CITY: LAPORTE, STATE: COLORADO, COUNTRY: UNITED STATES
NAME: RANDOLPH BEER DUMBO, CITY: BROOKLYN, STATE: NEW YORK, COUNTRY: UNITED STATES
NAME: RANDOM PRECISION BREWING COMPANY, CITY: COLUMBUS, STATE: OHIO, COUNTRY: UNITED STATES
NAME: RANDOM ROW BREWING CO., CITY: CHARLOTTESVILLE, STATE: VIRGINIA, COUNTRY: UNITED STATES
NAME: RANEY CELLARS, CITY: MILLERSVILLE, STATE: PENNSYLVANIA, COUNTRY: UNITED STATES
NAME: RANGER CREEK BREWERY, CITY: SAN ANTONIO, STATE: TEXAS, COUNTRY: UNITED STATES
NAME: RÂNOGGIN BREWING, CITY: KENOSHA, STATE: WISCONSIN, COUNTRY: UNITED STATES
NAME: RANTS AND RAVES BREWERY, CITY: MOSCOW, STATE: IDAHO, COUNTRY: UNITED STATES
NAME: RAPP BREWING COMPANY, CITY: SEMINOLE, STATE: FLORIDA, COUNTRY: UNITED STATES
NAME: RAPP'S BARREN BREWING COMPANY, CITY: MOUNTAIN HOME, STATE: ARKANSAS, COUNTRY: UNITED STATES
NAME: RAPSCALLION ALES, CITY: ACTON, STATE: MASSACHUSETTS, COUNTRY: UNITED STATES
NAME: RAQUETTE RIVER BREWING, CITY: TUPPER LAKE, STATE: NEW YORK, COUNTRY: UNITED STATES
NAME: RAR BREWING, CITY: CAMBRIDGE, STATE: MARYLAND, COUNTRY: UNITED STATES
NAME: RARE BIRD BREWPUB, CITY: TRAVERSE CITY, STATE: MICHIGAN, COUNTRY: UNITED STATES
NAME: RARE FORM BREWING, CITY: TROY, STATE: NEW YORK, COUNTRY: UNITED STATES
NAME: RARITAN BAY BREWING, LLC, CITY: KEANSBURG, STATE: NEW JERSEY, COUNTRY: UNITED STATES
NAME: RASCALS BREWING COMPANY, CITY: INCHICORE, STATE: DUBLIN, COUNTRY: IRELAND
NAME: RATCHET BREWERY SALEM, CITY: SALEM, STATE: OREGON, COUNTRY: UNITED STATES
NAME: RATCHET BREWERY SILVERTON, CITY: SILVERTON, STATE: OREGON, COUNTRY: UNITED STATES
NAME: RATIO BEERWORKS, CITY: DENVER, STATE: COLORADO, COUNTRY: UNITED STATES
NAME: RATTLESNAKE MOUNTAIN BREWERY / KIMO'S RESTAURANT, CITY: RICHLAND, STATE: WASHINGTON, COUNTRY: UNITED STATES
NAME: RAVENNA BREWING COMPANY, CITY: SEATTLE, STATE: WASHINGTON, COUNTRY: UNITED STATES
NAME: RAVENOUS BREWING COMPANY, CITY: CUMBERLAND, STATE: RHODE ISLAND, COUNTRY: UNITED STATES
NAME: RAVINIA BREWING COMPANY, CITY: HIGHLAND PARK, STATE: ILLINOIS, COUNTRY: UNITED STATES
NAME: RAW DEAL, CITY: MENOMONIE, STATE: WISCONSIN, COUNTRY: UNITED STATES
NAME: REACH BREAK BREWING, CITY: ASTORIA, STATE: OREGON, COUNTRY: UNITED STATES
NAME: READS LANDING BREWING CO, CITY: READS LANDING, STATE: MINNESOTA, COUNTRY: UNITED STATES
NAME: REAL ALE BREWING CO, CITY: BLANCO, STATE: TEXAS, COUNTRY: UNITED STATES
NAME: REAL MCCOY BEER CO., CITY: DELMAR, STATE: NEW YORK, COUNTRY: UNITED STATES
NAME: REASON BEER, CITY: CHARLOTTESVILLE, STATE: VIRGINIA, COUNTRY: UNITED STATES
NAME: REAVER BEACH BREWING CO, CITY: VIRGINIA BEACH, STATE: VIRGINIA, COUNTRY: UNITED STATES
NAME: REBEL KETTLE BREWING COMPANY, CITY: LITTLE ROCK, STATE: ARKANSAS, COUNTRY: UNITED STATES
NAME: REBEL TOAD BREWING CO, CITY: CORPUS CHRISTI, STATE: TEXAS, COUNTRY: UNITED STATES
NAME: REBELLE BREWING, CITY: NOBLESVILLE, STATE: INDIANA, COUNTRY: UNITED STATES
NAME: RECESS BREWING, CITY: EDWARDSVILLE, STATE: ILLINOIS, COUNTRY: UNITED STATES
NAME: RECLAIMED RAILS BREWING COMPANY, CITY: BONDURANT, STATE: IOWA, COUNTRY: UNITED STATES
NAME: RECLAMATION BREWING COMPANY, CITY: BUTLER, STATE: PENNSYLVANIA, COUNTRY: UNITED STATES
NAME: RECON BREWING, CITY: BUTLER, STATE: PENNSYLVANIA, COUNTRY: UNITED STATES
NAME: RECTORY ALES LTD, CITY: HASSOCKS, STATE: WEST SUSSEX, COUNTRY: ENGLAND
NAME: RED BARN BREWING, CITY: DANVILLE, STATE: VERMONT, COUNTRY: UNITED STATES
NAME: RED BEAR BREWING CO, CITY: WASHINGTON, STATE: DISTRICT OF COLUMBIA, COUNTRY: UNITED STATES
NAME: RED BIRD, CITY: WALTHAM, STATE: MASSACHUSETTS, COUNTRY: UNITED STATES
NAME: RED BRANCH BREWING COMPANY / RABBITS FOOT MEADERY, CITY: SUNNYVALE, STATE: CALIFORNIA, COUNTRY: UNITED STATES
NAME: RED BRICK BREWING CO / ATLANTA BREWING CO, CITY: ATLANTA, STATE: GEORGIA, COUNTRY: UNITED STATES
NAME: RED BUS BREWING COMPANY, CITY: FOLSOM, STATE: CALIFORNIA, COUNTRY: UNITED STATES
NAME: RED CAR BREWERY AND RESTAURANT, CITY: TORRANCE, STATE: CALIFORNIA, COUNTRY: UNITED STATES
NAME: RED CLAY BREWING COMPANY, CITY: OPELIKA, STATE: ALABAMA, COUNTRY: UNITED STATES
NAME: RED CROW BREWING COMPANY, CITY: OLATHE, STATE: KANSAS, COUNTRY: UNITED STATES
NAME: RED CYPRESS BREWERY, CITY: WINTER SPRINGS, STATE: FLORIDA, COUNTRY: UNITED STATES
NAME: RED DIRT BREWING CO, CITY: OKLAHOMA CITY, STATE: OKLAHOMA, COUNTRY: UNITED STATES
NAME: RED DOOR BREWING CO, CITY: ALBUQUERQUE, STATE: NEW MEXICO, COUNTRY: UNITED STATES
NAME: RED DRAGON BREWERY, CITY: FREDERICKSBURG, STATE: VIRGINIA, COUNTRY: UNITED STATES
NAME: RED EYE BREWING CO, CITY: WAUSAU, STATE: WISCONSIN, COUNTRY: UNITED STATES
NAME: RED GAP BREWING, CITY: CISCO, STATE: TEXAS, COUNTRY: UNITED STATES
NAME: RED HARE BREWING COMPANY, CITY: MARIETTA, STATE: GEORGIA, COUNTRY: UNITED STATES
NAME: RED HAWK BREWING, CITY: SYRACUSE, STATE: NEW YORK, COUNTRY: UNITED STATES
NAME: RED HILL BREWING CO, CITY: CONCORD, STATE: NORTH CAROLINA, COUNTRY: UNITED STATES
NAME: RED HILLS BREWING CO, CITY: BIRMINGHAM, STATE: ALABAMA, COUNTRY: UNITED STATES
NAME: RED HORN BREWING CO., CITY: CEDAR PARK, STATE: TEXAS, COUNTRY: UNITED STATES
NAME: RED IRON BREWING COMPANY, CITY: LINCOLN, STATE: NEBRASKA, COUNTRY: UNITED STATES
NAME: RED JACKET BREWING AT MICHIGAN HOUSE CAFE, CITY: CALUMET, STATE: MICHIGAN, COUNTRY: UNITED STATES
NAME: RED LEG BREWING COMPANY, CITY: COLORADO SPRINGS, STATE: COLORADO, COUNTRY: UNITED STATES
NAME: RED LODGE ALES BREWING CO, CITY: RED LODGE, STATE: MONTANA, COUNTRY: UNITED STATES
NAME: RED MOUNTAIN BREWING, CITY: OURAY, STATE: COLORADO, COUNTRY: UNITED STATES
NAME: RED OAK BREWING CO, CITY: WHITSETT, STATE: NORTH CAROLINA, COUNTRY: UNITED STATES
NAME: RED RIVER BREWING CO, CITY: SHREVEPORT, STATE: LOUISIANA, COUNTRY: UNITED STATES
NAME: RED RIVER BREWING COMPANY, CITY: RED RIVER, STATE: NEW MEXICO, COUNTRY: UNITED STATES
NAME: RED ROCK BREWING CO, CITY: SALT LAKE CITY, STATE: UTAH, COUNTRY: UNITED STATES
NAME: RED ROCK BREWING CO - PRODUCTION, CITY: SALT LAKE CITY, STATE: UTAH, COUNTRY: UNITED STATES
NAME: RED SHED BREWING COMPANY, CITY: CHERRY VALLEY, STATE: NEW YORK, COUNTRY: UNITED STATES
NAME: RED SHEDMAN FARM BREWERY, CITY: MOUNT AIRY, STATE: MARYLAND, COUNTRY: UNITED STATES
NAME: RED SILO BREWING CO, CITY: COOKEVILLE, STATE: TENNESSEE, COUNTRY: UNITED STATES
NAME: RED TANDEM BREWERY, CITY: OXNARD, STATE: CALIFORNIA, COUNTRY: UNITED STATES
NAME: RED TRUCK BEER COMPANY, CITY: DENVER, STATE: COLORADO, COUNTRY: UNITED STATES
NAME: RED TRUCK BEER COMPANY LTD., CITY: FORT COLLINS, STATE: COLORADO, COUNTRY: UNITED STATES
NAME: RED WING BREWING COMPANY, CITY: RED WING, STATE: MINNESOTA, COUNTRY: UNITED STATES
NAME: REDBEARD BREWING CO, CITY: STAUNTON, STATE: VIRGINIA, COUNTRY: UNITED STATES
NAME: REDEMPTION ALEWERKS, CITY: INDIANAPOLIS, STATE: INDIANA, COUNTRY: UNITED STATES
NAME: REDGARDEN BREWERY, CITY: LOUISVILLE, STATE: COLORADO, COUNTRY: UNITED STATES
NAME: REDHOOK - CATAQUA PUBLIC HOUSE, CITY: PORTSMOUTH, STATE: NEW HAMPSHIRE, COUNTRY: UNITED STATES
NAME: REDHOOK BREWERY, CITY: SEATTLE, STATE: WASHINGTON, COUNTRY: UNITED STATES
NAME: REDIFER BREWING CO, CITY: YAKIMA, STATE: WASHINGTON, COUNTRY: UNITED STATES
NAME: REDLIGHT REDLIGHT BEER PARLOUR AND BREWERY, CITY: ORLANDO, STATE: FLORIDA, COUNTRY: UNITED STATES
NAME: REDLINE BREWING COMPANY, CITY: BURTON, STATE: MICHIGAN, COUNTRY: UNITED STATES
NAME: REDWOOD BREWING CO, CITY: FLINT, STATE: MICHIGAN, COUNTRY: UNITED STATES
NAME: REDWOOD CURTAIN BREWING CO, CITY: ARCATA, STATE: CALIFORNIA, COUNTRY: UNITED STATES
NAME: REDWOOD CURTAIN BREWING CO, CITY: EUREKA, STATE: CALIFORNIA, COUNTRY: UNITED STATES
NAME: REED CITY BREWING COMPANY, CITY: REED CITY, STATE: MICHIGAN, COUNTRY: UNITED STATES
NAME: REEL BREW CO, CITY: LOS ANGELES, STATE: CALIFORNIA, COUNTRY: UNITED STATES
NAME: REEL DEEL BREWERY, CITY: CROSSMOLINA, STATE: MAYO, COUNTRY: IRELAND
NAME: REFINED ALE BREWERY, CITY: LITTLE ROCK, STATE: ARKANSAS, COUNTRY: UNITED STATES
NAME: REFORMATION BREWERY, CITY: WOODSTOCK, STATE: GEORGIA, COUNTRY: UNITED STATES
NAME: REFUGE BREWERY, INC., CITY: TEMECULA, STATE: CALIFORNIA, COUNTRY: UNITED STATES
NAME: REINVENTION BREWING CO., CITY: MANCHESTER, STATE: NEW YORK, COUNTRY: UNITED STATES
NAME: REK-LIS BREWING COMPANY, CITY: BETHLEHEM, STATE: NEW HAMPSHIRE, COUNTRY: UNITED STATES
NAME: RELENTLESS BREWING CO, CITY: TEMECULA, STATE: CALIFORNIA, COUNTRY: UNITED STATES
NAME: RELIC BREWING, CITY: PLAINVILLE, STATE: CONNECTICUT, COUNTRY: UNITED STATES
NAME: REMEDY BREWING COMPANY, CITY: SIOUX FALLS, STATE: SOUTH DAKOTA, COUNTRY: UNITED STATES
NAME: REMNANT BREWING, CITY: SOMERVILLE, STATE: MASSACHUSETTS, COUNTRY: UNITED STATES
NAME: RENAISSANCE BREWING CO, CITY: TULSA, STATE: OKLAHOMA, COUNTRY: UNITED STATES
NAME: RENDEZVOUS JUNCTION BREWING COMPANY, CITY: ROGERS, STATE: ARKANSAS, COUNTRY: UNITED STATES
NAME: RENEGADE BREWING COMPANY, CITY: DENVER, STATE: COLORADO, COUNTRY: UNITED STATES
NAME: RENEGADE BREWING COMPANY - PRODUCTION, CITY: DENVER, STATE: COLORADO, COUNTRY: UNITED STATES
NAME: RENO BREWERY, CITY: RENO, STATE: NEVADA, COUNTRY: UNITED STATES
NAME: RENTSCH BREWERY, CITY: GEORGETOWN, STATE: TEXAS, COUNTRY: UNITED STATES
NAME: REPUBLIC BREWING CO, CITY: REPUBLIC, STATE: WASHINGTON, COUNTRY: UNITED STATES
NAME: RESCUE BREWING CO, CITY: UPLAND, STATE: CALIFORNIA, COUNTRY: UNITED STATES
NAME: RESIDENT BREWING, CITY: SAN DIEGO, STATE: CALIFORNIA, COUNTRY: UNITED STATES
NAME: RESIDENT CULTURE BREWING COMPANY LLC, CITY: CHARLOTTE, STATE: NORTH CAROLINA, COUNTRY: UNITED STATES
NAME: RESIGNATION BREWERY, CITY: AUSTIN, STATE: TEXAS, COUNTRY: UNITED STATES
NAME: RESOLUTE BREWING COMPANY, CITY: CENTENNIAL, STATE: COLORADO, COUNTRY: UNITED STATES
NAME: RESOLUTION BREWING COMPANY, CITY: ANCHORAGE, STATE: ALASKA, COUNTRY: UNITED STATES
NAME: RESONATE BREWERY + PIZZERIA, CITY: BELLEVUE, STATE: WASHINGTON, COUNTRY: UNITED STATES
NAME: RESTLESS MOONS BREWING, CITY: HARRISONBURG, STATE: VIRGINIA, COUNTRY: UNITED STATES
NAME: RESTORATION BREW WORX, CITY: DELAWARE, STATE: OHIO, COUNTRY: UNITED STATES
NAME: RESURGENCE BREWING COMPANY, CITY: BUFFALO, STATE: NEW YORK, COUNTRY: UNITED STATES
NAME: REUBEN'S BREWS, CITY: SEATTLE, STATE: WASHINGTON, COUNTRY: UNITED STATES
NAME: REUBEN'S BREWS TAPROOM, CITY: SEATTLE, STATE: WASHINGTON, COUNTRY: UNITED STATES
NAME: REUNION BREWERY, CITY: CORALVILLE, STATE: IOWA, COUNTRY: UNITED STATES
NAME: REVEL URBAN WINERY / REVEL OTR, CITY: CINCINNATI, STATE: OHIO, COUNTRY: UNITED STATES
NAME: REVELATION ALE WORKS, CITY: HALLOCK, STATE: MINNESOTA, COUNTRY: UNITED STATES
NAME: REVELATION CRAFT BREWING CO, CITY: REHOBOTH BEACH, STATE: DELAWARE, COUNTRY: UNITED STATES
NAME: REVELRY BREWING CO., CITY: CHARLESTON, STATE: SOUTH CAROLINA, COUNTRY: UNITED STATES
NAME: REVERIE BREWING COMPANY, CITY: NEWTOWN, STATE: CONNECTICUT, COUNTRY: UNITED STATES
NAME: REVISION BREWING COMPANY, CITY: SPARKS, STATE: NEVADA, COUNTRY: UNITED STATES
NAME: REVIVAL BREWING, CITY: CRANSTON, STATE: RHODE ISLAND, COUNTRY: UNITED STATES
NAME: REVOLUTION BREWING, CITY: CHICAGO, STATE: ILLINOIS, COUNTRY: UNITED STATES
NAME: REVOLUTION BREWING - BREWPUB, CITY: CHICAGO, STATE: ILLINOIS, COUNTRY: UNITED STATES
NAME: REVOLVER BREWING, CITY: GRANBURY, STATE: TEXAS, COUNTRY: UNITED STATES
NAME: RG BREWERY / FIVE SONS WINERY, CITY: BROCKPORT, STATE: NEW YORK, COUNTRY: UNITED STATES
NAME: RHINEGEIST BREWERY, CITY: CINCINNATI, STATE: OHIO, COUNTRY: UNITED STATES
NAME: RHINELANDER BREWING CO, CITY: RHINELANDER, STATE: WISCONSIN, COUNTRY: UNITED STATES
NAME: RHOMBUS GUYS BREWING CO, CITY: GRAND FORKS, STATE: NORTH DAKOTA, COUNTRY: UNITED STATES
NAME: RHYTHM RIVER BREWING COMPANY, CITY: LONGMONT, STATE: COLORADO, COUNTRY: UNITED STATES
NAME: RICHBRAU BREWING, CITY: RICHMOND, STATE: VIRGINIA, COUNTRY: UNITED STATES
NAME: RICHTER ALEWORKS, CITY: PEORIA, STATE: ARIZONA, COUNTRY: UNITED STATES
NAME: RICK TANNER'S GRILLE & BAR/CHERRY STREET BREWING COOPERATIVE, CITY: CUMMING, STATE: GEORGIA, COUNTRY: UNITED STATES
NAME: RICKETY CRICKET BREWING, CITY: KINGMAN, STATE: ARIZONA, COUNTRY: UNITED STATES
NAME: RIDGE RUNNER BREWING LLC, CITY: WAUSEON, STATE: OHIO, COUNTRY: UNITED STATES
NAME: RIDGEWALKER BREWING, CITY: FOREST GROVE, STATE: OREGON, COUNTRY: UNITED STATES
NAME: RIEPSTINES PUB, CITY: WILLIAMSPORT, STATE: PENNSYLVANIA, COUNTRY: UNITED STATES
NAME: RIFF RAFF BREWING, CITY: PAGOSA SPRINGS, STATE: COLORADO, COUNTRY: UNITED STATES
NAME: RIGGS BEER COMPANY, CITY: URBANA, STATE: ILLINOIS, COUNTRY: UNITED STATES
NAME: RIGHT AROUND THE CORNER, CITY: SAINT PETERSBURG, STATE: FLORIDA, COUNTRY: UNITED STATES
NAME: RIGHT BRAIN BREWERY, CITY: TRAVERSE CITY, STATE: MICHIGAN, COUNTRY: UNITED STATES
NAME: RIGHT EYE BREWING CO, CITY: SUISUN CITY, STATE: CALIFORNIA, COUNTRY: UNITED STATES
NAME: RIGHT MIND BREWING, CITY: BLACKSBURG, STATE: VIRGINIA, COUNTRY: UNITED STATES
NAME: RIGHT PROPER BREWING COMPANY, CITY: WASHINGTON, STATE: DISTRICT OF COLUMBIA, COUNTRY: UNITED STATES
NAME: RIGHT PROPER BREWING COMPANY, CITY: WASHINGTON, STATE: DISTRICT OF COLUMBIA, COUNTRY: UNITED STATES
NAME: RIGHT TURN, CLYDE BREWING COMPANY, CITY: NARROWS, STATE: VIRGINIA, COUNTRY: UNITED STATES
NAME: RIIP BEER COMPANY, CITY: HUNTINGTON BEACH, STATE: CALIFORNIA, COUNTRY: UNITED STATES
NAME: RILEY'S BREW PUB, CITY: CLOVIS, STATE: CALIFORNIA, COUNTRY: UNITED STATES
NAME: RILEY'S BREWING CO, CITY: MADERA, STATE: CALIFORNIA, COUNTRY: UNITED STATES
NAME: RINCON BREWERY, CITY: CARPINTERIA, STATE: CALIFORNIA, COUNTRY: UNITED STATES
NAME: RINN DUIN BREWING, CITY: TOMS RIVER, STATE: NEW JERSEY, COUNTRY: UNITED STATES
NAME: RIO BRAVO BREWING COMPANY, CITY: ALBUQUERQUE, STATE: NEW MEXICO, COUNTRY: UNITED STATES
NAME: RIP CURRENT BREWERY, CITY: SAN MARCOS, STATE: CALIFORNIA, COUNTRY: UNITED STATES
NAME: RIP CURRENT BREWING NORTH PARK, CITY: SAN DIEGO, STATE: CALIFORNIA, COUNTRY: UNITED STATES
NAME: RIP RAP BREWING COMPANY, CITY: NORFOLK, STATE: VIRGINIA, COUNTRY: UNITED STATES
NAME: RIP VAN WINKLE BREWING CO., CITY: CATSKILL, STATE: NEW YORK, COUNTRY: UNITED STATES
NAME: RIPPON BREWING COMPANY, CITY: RIPPON, STATE: WEST VIRGINIA, COUNTRY: UNITED STATES
NAME: RIPTIDE BREWING COMPANY, CITY: NAPLES, STATE: FLORIDA, COUNTRY: UNITED STATES
NAME: RISING SILO BREWERY, CITY: BLACKSBURG, STATE: VIRGINIA, COUNTRY: UNITED STATES
NAME: RISING SONS BREWERY, CITY: CORK, STATE: CORK, COUNTRY: IRELAND
NAME: RISING TIDE BREWING CO, CITY: PORTLAND, STATE: MAINE, COUNTRY: UNITED STATES
NAME: RITT BREWING COMPANY, CITY: CHICAGO, STATE: ILLINOIS, COUNTRY: UNITED STATES
NAME: RITTER BREWING COMPANY LLC, CITY: PECKVILLE, STATE: PENNSYLVANIA, COUNTRY: UNITED STATES
NAME: RITUAL BREWING CO, CITY: REDLANDS, STATE: CALIFORNIA, COUNTRY: UNITED STATES
NAME: RIVALS BREWING COMPANY, CITY: MIDDLEBURG HTS, STATE: OHIO, COUNTRY: UNITED STATES
NAME: RIVALS SPORTS GRILLE, CITY: MIDDLEBURG HEIGHTS, STATE: OHIO, COUNTRY: UNITED STATES
NAME: RIVER BARGE BREWING, CITY: WYALUSING, STATE: PENNSYLVANIA, COUNTRY: UNITED STATES
NAME: RIVER BEND BREWING, CITY: HAILEY, STATE: IDAHO, COUNTRY: UNITED STATES
NAME: RIVER BEND HOP FARM AND BREWERY, CITY: NEWPORT, STATE: PENNSYLVANIA, COUNTRY: UNITED STATES
NAME: RIVER BLUFF BREWING, CITY: ST JOSEPH, STATE: MISSOURI, COUNTRY: UNITED STATES
NAME: RIVER BOTTOMS BREWING COMPANY, CITY: CARROLLTON, STATE: MISSOURI, COUNTRY: UNITED STATES
NAME: RIVER CITY BREWING, CITY: SPOKANE, STATE: WASHINGTON, COUNTRY: UNITED STATES
NAME: RIVER CITY BREWING CO, CITY: SACRAMENTO, STATE: CALIFORNIA, COUNTRY: UNITED STATES
NAME: RIVER CITY BREWING CO, CITY: JACKSONVILLE, STATE: FLORIDA, COUNTRY: UNITED STATES
NAME: RIVER CITY BREWING CO, CITY: WICHITA, STATE: KANSAS, COUNTRY: UNITED STATES
NAME: RIVER COMPANY RESTAURANT & BREWERY INC, THE, CITY: FAIRLAWN, STATE: VIRGINIA, COUNTRY: UNITED STATES
NAME: RIVER DOG BREWING CO, CITY: RIDGELAND, STATE: SOUTH CAROLINA, COUNTRY: UNITED STATES
NAME: RIVER HAWK BREWING, CITY: CHANNAHON, STATE: ILLINOIS, COUNTRY: UNITED STATES
NAME: RIVER HORSE BREWING COMPANY, CITY: EWING, STATE: NEW JERSEY, COUNTRY: UNITED STATES
NAME: RIVER MILE 38 BREWING CO, CITY: CATHLAMET, STATE: WASHINGTON, COUNTRY: UNITED STATES
NAME: RIVER NORTH BREWERY, CITY: DENVER, STATE: COLORADO, COUNTRY: UNITED STATES
NAME: RIVER NORTH BREWERY - RINO, CITY: DENVER, STATE: COLORADO, COUNTRY: UNITED STATES
NAME: RIVER OF NO RETURN BREWING CO, CITY: CHALLIS, STATE: IDAHO, COUNTRY: UNITED STATES
NAME: RIVER RAT BREWERY, CITY: COLUMBIA, STATE: SOUTH CAROLINA, COUNTRY: UNITED STATES
NAME: RIVER RIDGE BREWING, CITY: BELLEVUE, STATE: IOWA, COUNTRY: UNITED STATES
NAME: RIVER ROCK BREWERY, CITY: GALT, STATE: CALIFORNIA, COUNTRY: UNITED STATES
NAME: RIVER ROOST BREWERY, CITY: WHITE RIVER JUNCTION, STATE: VERMONT, COUNTRY: UNITED STATES
NAME: RIVER ROUGE BREWING COMPANY, CITY: ROYAL OAK, STATE: MICHIGAN, COUNTRY: UNITED STATES
NAME: RIVER STYX BREWING, CITY: FITCHBURG, STATE: MASSACHUSETTS, COUNTRY: UNITED STATES
NAME: RIVER TIME BREWING, CITY: DARRINGTON, STATE: WASHINGTON, COUNTRY: UNITED STATES
NAME: RIVER'S EDGE BREWING CO, CITY: MILFORD, STATE: MICHIGAN, COUNTRY: UNITED STATES
NAME: RIVERBEND BREWING PUB, CITY: BEND, STATE: OREGON, COUNTRY: UNITED STATES
NAME: RIVERLANDS BREWING COMPANY, CITY: SAINT CHARLES, STATE: ILLINOIS, COUNTRY: UNITED STATES
NAME: RIVERMEN BREWING CO, CITY: BELMONT, STATE: NORTH CAROLINA, COUNTRY: UNITED STATES
NAME: RIVERPORT BREWING CO, CITY: CLARKSTON, STATE: WASHINGTON, COUNTRY: UNITED STATES
NAME: RIVERSIDE BREWERY &  RESTAURANT, CITY: WEST BEND, STATE: WISCONSIN, COUNTRY: UNITED STATES
NAME: RIVERSIDE BREWING LTD, CITY: STEYNING, STATE: WEST SUSSEX, COUNTRY: ENGLAND
NAME: RIVERTOWN BREWING CO - MONROE BARREL HOUSE, CITY: MONROE, STATE: OHIO, COUNTRY: UNITED STATES
NAME: RIVERTOWNE BREWERY - PRODUCTION FACILITY, CITY: EXPORT, STATE: PENNSYLVANIA, COUNTRY: UNITED STATES
NAME: RIVERTOWNE POUR HOUSE, CITY: MONROEVILLE, STATE: PENNSYLVANIA, COUNTRY: UNITED STATES
NAME: RIVERWALK BREWING CO., CITY: NEWBURYPORT, STATE: MASSACHUSETTS, COUNTRY: UNITED STATES
NAME: RIVERWATCH BREWERY, CITY: AUGUSTA, STATE: GEORGIA, COUNTRY: UNITED STATES
NAME: RJ ROCKERS BREWING CO, CITY: SPARTANBURG, STATE: SOUTH CAROLINA, COUNTRY: UNITED STATES
NAME: ROADHOUSE BREWING COMPANY, CITY: JACKSON, STATE: WYOMING, COUNTRY: UNITED STATES
NAME: ROADHOUSE PUB AND EATERY, CITY: JACKSON HOLE, STATE: WYOMING, COUNTRY: UNITED STATES
NAME: ROADMAP BREWING CO, CITY: SAN ANTONIO, STATE: TEXAS, COUNTRY: UNITED STATES
NAME: ROADRUNNER ABBEY BREWING, CITY: CHANDLER, STATE: ARIZONA, COUNTRY: UNITED STATES
NAME: ROAK BREWING CO., CITY: ROYAL OAK, STATE: MICHIGAN, COUNTRY: UNITED STATES
NAME: ROARING FORK BEER COMPANY, CITY: CARBONDALE, STATE: COLORADO, COUNTRY: UNITED STATES
NAME: ROARING TABLE BREWING, CITY: LAKE ZURICH, STATE: ILLINOIS, COUNTRY: UNITED STATES
NAME: ROBIN HOOD BREWING CO, CITY: BELLEFONTE, STATE: PENNSYLVANIA, COUNTRY: UNITED STATES
NAME: ROC BREWING CO, CITY: ROCHESTER, STATE: NEW YORK, COUNTRY: UNITED STATES
NAME: ROCHESTER MILLS BEER CO, CITY: ROCHESTER, STATE: MICHIGAN, COUNTRY: UNITED STATES
NAME: ROCHESTER MILLS PRODUCTION BREWERY, CITY: AUBURN HILLS, STATE: MICHIGAN, COUNTRY: UNITED STATES
NAME: ROCK & RUN BREWERY, CITY: LIBERTY, STATE: MISSOURI, COUNTRY: UNITED STATES
NAME: ROCK ART BREWERY, CITY: MORRISVILLE, STATE: VERMONT, COUNTRY: UNITED STATES
NAME: ROCK BOTTOM BREWERY, CITY: DAYTONA BEACH, STATE: FLORIDA, COUNTRY: UNITED STATES
NAME: ROCK BOTTOM BREWERY - ARROWHEAD, CITY: GLENDALE, STATE: ARIZONA, COUNTRY: UNITED STATES
NAME: ROCK BOTTOM BREWERY - BETHESDA, CITY: BETHESDA, STATE: MARYLAND, COUNTRY: UNITED STATES
NAME: ROCK BOTTOM BREWERY - CENTERRA PROMENADE, CITY: LOVELAND, STATE: COLORADO, COUNTRY: UNITED STATES
NAME: ROCK BOTTOM BREWERY - CHICAGO, CITY: CHICAGO, STATE: ILLINOIS, COUNTRY: UNITED STATES
NAME: ROCK BOTTOM BREWERY - CINCINNATI, CITY: CINCINNATI, STATE: OHIO, COUNTRY: UNITED STATES
NAME: ROCK BOTTOM BREWERY - COLORADO SPRINGS, CITY: COLORADO SPRINGS, STATE: COLORADO, COUNTRY: UNITED STATES
NAME: ROCK BOTTOM BREWERY - DENVER, CITY: DENVER, STATE: COLORADO, COUNTRY: UNITED STATES
NAME: ROCK BOTTOM BREWERY - ENGLEWOOD, CITY: ENGLEWOOD, STATE: COLORADO, COUNTRY: UNITED STATES
NAME: ROCK BOTTOM BREWERY - HIGHLANDS RANCH, CITY: HIGHLANDS RANCH, STATE: COLORADO, COUNTRY: UNITED STATES
NAME: ROCK BOTTOM BREWERY - INDIANAPOLIS, CITY: INDIANAPOLIS, STATE: INDIANA, COUNTRY: UNITED STATES
NAME: ROCK BOTTOM BREWERY - LA JOLLA, CITY: LA JOLLA, STATE: CALIFORNIA, COUNTRY: UNITED STATES
NAME: ROCK BOTTOM BREWERY - LONG BEACH, CITY: LONG BEACH, STATE: CALIFORNIA, COUNTRY: UNITED STATES
NAME: ROCK BOTTOM BREWERY - MILWAUKEE, CITY: MILWAUKEE, STATE: WISCONSIN, COUNTRY: UNITED STATES
NAME: ROCK BOTTOM BREWERY - MINNEAPOLIS, CITY: MINNEAPOLIS, STATE: MINNESOTA, COUNTRY: UNITED STATES
NAME: ROCK BOTTOM BREWERY - NASHVILLE, CITY: NASHVILLE, STATE: TENNESSEE, COUNTRY: UNITED STATES
NAME: ROCK BOTTOM BREWERY - ORCHARD CNTR, CITY: WESTMINSTER, STATE: COLORADO, COUNTRY: UNITED STATES
NAME: ROCK BOTTOM BREWERY - ORLAND PARK, CITY: ORLAND PARK, STATE: ILLINOIS, COUNTRY: UNITED STATES
NAME: ROCK BOTTOM BREWERY - PITTSBURGH, CITY: HOMESTEAD, STATE: PENNSYLVANIA, COUNTRY: UNITED STATES
NAME: ROCK BOTTOM BREWERY - PORTLAND, CITY: PORTLAND, STATE: OREGON, COUNTRY: UNITED STATES
NAME: ROCK BOTTOM BREWERY - SAN JOSE, CITY: CAMPBELL, STATE: CALIFORNIA, COUNTRY: UNITED STATES
NAME: ROCK BOTTOM BREWERY - WARRENVILLE, CITY: WARRENVILLE, STATE: ILLINOIS, COUNTRY: UNITED STATES
NAME: ROCK BOTTOM BREWERY - WESTMINSTER, CITY: WESTMINSTER, STATE: COLORADO, COUNTRY: UNITED STATES
NAME: ROCK BOTTOM BREWERY - YORKTOWN, CITY: LOMBARD, STATE: ILLINOIS, COUNTRY: UNITED STATES
NAME: ROCK BOTTOM BREWERY -SHORT PUMP, CITY: RICHMOND, STATE: VIRGINIA, COUNTRY: UNITED STATES
NAME: ROCK BOTTOM BREWERY- CHARLOTTE, CITY: CHARLOTTE, STATE: NORTH CAROLINA, COUNTRY: UNITED STATES
NAME: ROCK COUNTY BREWING COMPANY, CITY: JANESVILLE, STATE: WISCONSIN, COUNTRY: UNITED STATES
NAME: ROCK CUT BREWING COMPANY, CITY: ESTES PARK, STATE: COLORADO, COUNTRY: UNITED STATES
