NAME: (405) BREWING CO, CITY: NORMAN, STATE: OKLAHOMA, COUNTRY: UNITED STATES
NAME: (512) BREWING CO, CITY: AUSTIN, STATE: TEXAS, COUNTRY: UNITED STATES
NAME: 10 BARREL BREWING CO, CITY: SAN DIEGO, STATE: CALIFORNIA, COUNTRY: UNITED STATES
NAME: 10 BARREL BREWING CO, CITY: BEND, STATE: OREGON, COUNTRY: UNITED STATES
NAME: 10 BARREL BREWING CO, CITY: BEND, STATE: OREGON, COUNTRY: UNITED STATES
NAME: 10 BARREL BREWING CO, CITY: PORTLAND, STATE: OREGON, COUNTRY: UNITED STATES
NAME: 10 BARREL BREWING CO - BEND PUB, CITY: BEND, STATE: OREGON, COUNTRY: UNITED STATES
NAME: 10 BARREL BREWING CO - BOISE, CITY: BOISE, STATE: IDAHO, COUNTRY: UNITED STATES
NAME: 10 BARREL BREWING CO - DENVER, CITY: DENVER, STATE: COLORADO, COUNTRY: UNITED STATES
NAME: 10 TORR DISTILLING AND BREWING, CITY: RENO, STATE: NEVADA, COUNTRY: UNITED STATES
NAME: 10-56 BREWING COMPANY, CITY: KNOX, STATE: INDIANA, COUNTRY: UNITED STATES
NAME: 101 BREWERY, CITY: QUILCENE, STATE: WASHINGTON, COUNTRY: UNITED STATES
NAME: 101 NORTH BREWING COMPANY, CITY: PETALUMA, STATE: CALIFORNIA, COUNTRY: UNITED STATES
NAME: 105 WEST BREWING CO, CITY: CASTLE ROCK, STATE: COLORADO, COUNTRY: UNITED STATES
NAME: 10K BREWING, CITY: ANOKA, STATE: MINNESOTA, COUNTRY: UNITED STATES
NAME: 10TH DISTRICT BREWING COMPANY, CITY: ABINGTON, STATE: MASSACHUSETTS, COUNTRY: UNITED STATES
NAME: 11 BELOW BREWING COMPANY, CITY: HOUSTON, STATE: TEXAS, COUNTRY: UNITED STATES
NAME: 1188 BREWING CO, CITY: JOHN DAY, STATE: OREGON, COUNTRY: UNITED STATES
NAME: 12 ACRES BREWING COMPANY, CITY: KILLESHIN, STATE: LAOIS, COUNTRY: IRELAND
NAME: 12 GATES BREWING COMPANY, CITY: WILLIAMSVILLE, STATE: NEW YORK, COUNTRY: UNITED STATES
NAME: 12 WEST BREWING COMPANY, CITY: GILBERT, STATE: ARIZONA, COUNTRY: UNITED STATES
NAME: 12 WEST BREWING COMPANY - PRODUCTION FACILITY, CITY: MESA, STATE: ARIZONA, COUNTRY: UNITED STATES
NAME: 122 WEST BREWING CO, CITY: BELLINGHAM, STATE: WASHINGTON, COUNTRY: UNITED STATES
NAME: 127 BREWING, CITY: JACKSON, STATE: MICHIGAN, COUNTRY: UNITED STATES
NAME: 12DEGREE BREWING, CITY: LOUISVILLE, STATE: COLORADO, COUNTRY: UNITED STATES
NAME: 12WELVE EYES BREWING, CITY: SAINT PAUL, STATE: MINNESOTA, COUNTRY: UNITED STATES
NAME: 13 BELOW BREWERY, CITY: CINCINNATI, STATE: OHIO, COUNTRY: UNITED STATES
NAME: 13 STRIPES BREWERY, CITY: TAYLORS, STATE: SOUTH CAROLINA, COUNTRY: UNITED STATES
NAME: 13 VIRTUES BREWING CO, CITY: PORTLAND, STATE: OREGON, COUNTRY: UNITED STATES
NAME: 1323 R & D, CITY: RALEIGH, STATE: NORTH CAROLINA, COUNTRY: UNITED STATES
NAME: 14 CANNONS BREWING COMPANY, CITY: WESTLAKE VILLAGE, STATE: CALIFORNIA, COUNTRY: UNITED STATES
NAME: 14 LAKES BREWERY, CITY: CROSSLAKE, STATE: MINNESOTA, COUNTRY: UNITED STATES
NAME: 14ER BREWING COMPANY, CITY: DENVER, STATE: COLORADO, COUNTRY: UNITED STATES
NAME: 14TH STAR BREWING, CITY: SAINT ALBANS, STATE: VERMONT, COUNTRY: UNITED STATES
NAME: 16 LOTS BREWING, CITY: MASON, STATE: OHIO, COUNTRY: UNITED STATES
NAME: 16 MILE BREWING CO, CITY: GEORGETOWN, STATE: DELAWARE, COUNTRY: UNITED STATES
NAME: 16 STONE BREWPUB, CITY: HOLLAND PATENT, STATE: NEW YORK, COUNTRY: UNITED STATES
NAME: 1623 BREWING CO, LLC, CITY: WESTMINISTER, STATE: MARYLAND, COUNTRY: UNITED STATES
NAME: 1717 BREWING CO, CITY: DES MOINES, STATE: IOWA, COUNTRY: UNITED STATES
NAME: 1718 OCRACOKE BREWING, CITY: OCRACOKE, STATE: NORTH CAROLINA, COUNTRY: UNITED STATES
NAME: 1781 BREWING COMPANY, CITY: SPOTSYLVANIA, STATE: VIRGINIA, COUNTRY: UNITED STATES
NAME: 180 AND TAPPED, CITY: CORAOPOLIS, STATE: PENNSYLVANIA, COUNTRY: UNITED STATES
NAME: 1817 BREWERY, CITY: OKOLONA, STATE: MISSISSIPPI, COUNTRY: UNITED STATES
NAME: 1840 BREWING COMPANY, CITY: MILWAUKEE, STATE: WISCONSIN, COUNTRY: UNITED STATES
NAME: 1850 BREWING COMPANY, CITY: MARIPOSA, STATE: CALIFORNIA, COUNTRY: UNITED STATES
NAME: 18TH STREET BREWERY, CITY: GARY, STATE: INDIANA, COUNTRY: UNITED STATES
NAME: 18TH STREET BREWERY, CITY: HAMMOND, STATE: INDIANA, COUNTRY: UNITED STATES
NAME: 1905 BREWING COMPANY, CITY: ASSUMPTION, STATE: ILLINOIS, COUNTRY: UNITED STATES
NAME: 1912 BREWING, CITY: TUCSON, STATE: ARIZONA, COUNTRY: UNITED STATES
NAME: 192 BREWING, CITY: KENMORE, STATE: WASHINGTON, COUNTRY: UNITED STATES
NAME: 1940'S BREWING COMPANY, CITY: HOLBROOK, STATE: NEW YORK, COUNTRY: UNITED STATES
NAME: 1ST REPUBLIC BREWING CO, CITY: ESSEX JUNCTION, STATE: VERMONT, COUNTRY: UNITED STATES
NAME: 2 BASSET BREWERY, CITY: WHITE SULPHUR SPRINGS, STATE: MONTANA, COUNTRY: UNITED STATES
NAME: 2 DOGZ AND A GUY BREWING, CITY: MONTROSE, STATE: PENNSYLVANIA, COUNTRY: UNITED STATES
NAME: 2 FEET BREWING COMPANY, CITY: BANGOR, STATE: MAINE, COUNTRY: UNITED STATES
NAME: 2 ROW BREWING, CITY: MIDVALE, STATE: UTAH, COUNTRY: UNITED STATES
NAME: 2 SILOS BREWING COMPANY, CITY: MANASSAS, STATE: VIRGINIA, COUNTRY: UNITED STATES
NAME: 2 TONES BREWING CO., CITY: WHITEHALL, STATE: OHIO, COUNTRY: UNITED STATES
NAME: 2 TREAD BREWING CO, CITY: SANTA ROSA, STATE: CALIFORNIA, COUNTRY: UNITED STATES
NAME: 2 WAY BREWING COMPANY, CITY: BEACON, STATE: NEW YORK, COUNTRY: UNITED STATES
NAME: 2 WITCHES WINERY AND BREWING COMPANY, CITY: DANVILLE, STATE: VIRGINIA, COUNTRY: UNITED STATES
NAME: 20 CORNERS BREWING LLC, CITY: WOODINVILLE, STATE: WASHINGTON, COUNTRY: UNITED STATES
NAME: 210 BREWING CO, CITY: ARLINGTON, STATE: WASHINGTON, COUNTRY: UNITED STATES
NAME: 212 BREWING COMPANY, CITY: DAVENPORT, STATE: NEW YORK, COUNTRY: UNITED STATES
NAME: 217 BREW WORKS, CITY: WILSON, STATE: NORTH CAROLINA, COUNTRY: UNITED STATES
NAME: 21ST AMENDMENT BREWERY, CITY: SAN LEANDRO, STATE: CALIFORNIA, COUNTRY: UNITED STATES
NAME: 21ST AMENDMENT BREWERY CAFE, CITY: SAN FRANCISCO, STATE: CALIFORNIA, COUNTRY: UNITED STATES
NAME: 21ST ST BREWERS BAR, CITY: SAINT LOUIS, STATE: MISSOURI, COUNTRY: UNITED STATES
NAME: 23 BREWING COMPANY / LIZZIE B'S CAFE, CITY: PRESTONSBURG, STATE: KENTUCKY, COUNTRY: UNITED STATES
NAME: 238 BREWING COMPANY, CITY: MEAD, STATE: WASHINGTON, COUNTRY: UNITED STATES
NAME: 23RD STREET BREWERY, CITY: LAWRENCE, STATE: KANSAS, COUNTRY: UNITED STATES
NAME: 26 DEGREE BREWING COMPANY, CITY: POMPANO BEACH, STATE: FLORIDA, COUNTRY: UNITED STATES
NAME: 28TH STATE BREWING, CITY: HOUSTON, STATE: TEXAS, COUNTRY: UNITED STATES
NAME: 2C FAMILY BREWING CO., CITY: NAMPA, STATE: IDAHO, COUNTRY: UNITED STATES
NAME: 2KIDS BREWING COMPANY, CITY: SAN DIEGO, STATE: CALIFORNIA, COUNTRY: UNITED STATES
NAME: 2ND SHIFT BREWING CO, CITY: SAINT LOUIS, STATE: MISSOURI, COUNTRY: UNITED STATES
NAME: 2ND STORY BREWING COMPANY, CITY: PHILADELPHIA, STATE: PENNSYLVANIA, COUNTRY: UNITED STATES
NAME: 2SP BREWING COMPANY, CITY: ASTON, STATE: PENNSYLVANIA, COUNTRY: UNITED STATES
NAME: 3 BEARDS BEER COMPANY, CITY: WILLIAMSBURG, STATE: MASSACHUSETTS, COUNTRY: UNITED STATES
NAME: 3 DAUGHTERS BREWING, CITY: SAINT PETERSBURG, STATE: FLORIDA, COUNTRY: UNITED STATES
NAME: 3 DISCIPLES BREWING, CITY: SEBASTOPOL, STATE: CALIFORNIA, COUNTRY: UNITED STATES
NAME: 3 FREAKS BREWING CO, CITY: HIGHLANDS RANCH, STATE: COLORADO, COUNTRY: UNITED STATES
NAME: 3 IRON BREWING COMPANY, CITY: COLTON, STATE: CALIFORNIA, COUNTRY: UNITED STATES
NAME: 3 KEYS BREWING COMPANY, LLC, CITY: BRADENTON, STATE: FLORIDA, COUNTRY: UNITED STATES
NAME: 3 NATIONS BREWING, CITY: FARMERS BRANCH, STATE: TEXAS, COUNTRY: UNITED STATES
NAME: 3 SHEEPS BREWING CO, CITY: SHEBOYGAN, STATE: WISCONSIN, COUNTRY: UNITED STATES
NAME: 3 SHEETS BREWERY, CITY: ALBANY, STATE: OREGON, COUNTRY: UNITED STATES
NAME: 3 SONS BREWING CO., CITY: DANIA, STATE: FLORIDA, COUNTRY: UNITED STATES
NAME: 3 STARS BREWING CO, CITY: WASHINGTON, STATE: DISTRICT OF COLUMBIA, COUNTRY: UNITED STATES
NAME: 3 TRAILS BREWING CO, CITY: INDEPENDENCE, STATE: MISSOURI, COUNTRY: UNITED STATES
NAME: 30 MILE BREWING CO., CITY: OLD SAYBROOK, STATE: CONNECTICUT, COUNTRY: UNITED STATES
NAME: 300 SUNS BREWING COMPANY, CITY: LONGMONT, STATE: COLORADO, COUNTRY: UNITED STATES
NAME: 32 NORTH BREWING CO, CITY: SAN DIEGO, STATE: CALIFORNIA, COUNTRY: UNITED STATES
NAME: 34 DEGREE NORTH EXPERIMENT STATION, CITY: SHALLOTTE, STATE: NORTH CAROLINA, COUNTRY: UNITED STATES
NAME: 350 BREWING CO, CITY: TINLEY PARK, STATE: ILLINOIS, COUNTRY: UNITED STATES
NAME: 360 DEGREE BREWING COMPANY, CITY: SHEFFIELD PARK, STATE: EAST SUSSEX, COUNTRY: ENGLAND
NAME: 38 STATE BREWING, CITY: LITTLETON, STATE: COLORADO, COUNTRY: UNITED STATES
NAME: 380 BREWING COMPANY, CITY: CLANCY, STATE: MONTANA, COUNTRY: UNITED STATES
NAME: 38Â°-75Â° BREWING, CITY: REHOBOTH BEACH, STATE: DELAWARE, COUNTRY: UNITED STATES
NAME: 3CROSS FERMENTATION COOPERATIVE, CITY: WORCESTER, STATE: MASSACHUSETTS, COUNTRY: UNITED STATES
NAME: 3HALVES BREWING CO, CITY: LIBERTY, STATE: MISSOURI, COUNTRY: UNITED STATES
NAME: 3RD DEGREE BREWHOUSE, CITY: FUQUAY VARINA, STATE: NORTH CAROLINA, COUNTRY: UNITED STATES
NAME: 3RD PLANET BREWING, CITY: NICEVILLE, STATE: FLORIDA, COUNTRY: UNITED STATES
NAME: 3RD ROCK BREWING COMPANY, CITY: TRENTON, STATE: NORTH CAROLINA, COUNTRY: UNITED STATES
NAME: 3RD TURN BREWING, CITY: LOUISVILLE, STATE: KENTUCKY, COUNTRY: UNITED STATES
NAME: 3RD WAVE BREWING CO, CITY: DELMAR, STATE: DELAWARE, COUNTRY: UNITED STATES
NAME: 4 BY 4 BREWING COMPANY, CITY: SPRINGFIELD, STATE: MISSOURI, COUNTRY: UNITED STATES
NAME: 4 HANDS BREWING CO, CITY: SAINT LOUIS, STATE: MISSOURI, COUNTRY: UNITED STATES
NAME: 4 NOSES BREWING COMPANY, CITY: BROOMFIELD, STATE: COLORADO, COUNTRY: UNITED STATES
NAME: 4 STITCH BREWING CO, CITY: BOTHELL, STATE: WASHINGTON, COUNTRY: UNITED STATES
NAME: 400 NORTH BREWING, CITY: SUGARHILL, STATE: GEORGIA, COUNTRY: UNITED STATES
NAME: 406 BREWING COMPANY, CITY: BOZEMAN, STATE: MONTANA, COUNTRY: UNITED STATES
NAME: 411 BROADWAY ALES, CITY: FRESNO, STATE: CALIFORNIA, COUNTRY: UNITED STATES
NAME: 412 BREWS, CITY: MC KEES ROCKS, STATE: PENNSYLVANIA, COUNTRY: UNITED STATES
NAME: 42 NORTH BREWING COMPANY, CITY: EAST AURORA, STATE: NEW YORK, COUNTRY: UNITED STATES
NAME: 4204 MAIN STREET BREWING CO, CITY: BELLEVILLE, STATE: ILLINOIS, COUNTRY: UNITED STATES
NAME: 450 NORTH BREWING COMPANY @ SIMMONS WINERY, CITY: COLUMBUS, STATE: INDIANA, COUNTRY: UNITED STATES
NAME: 47 HILLS BREWING CO, CITY: SOUTH SAN FRANCISCO, STATE: CALIFORNIA, COUNTRY: UNITED STATES
NAME: 49TH STATE BREWING CO, CITY: HEALY, STATE: ALASKA, COUNTRY: UNITED STATES
NAME: 49TH STATE BREWING CO - ANCHORAGE, CITY: ANCHORAGE, STATE: ALASKA, COUNTRY: UNITED STATES
NAME: 4B'S BREWERY, CITY: CEDAREDGE, STATE: COLORADO, COUNTRY: UNITED STATES
NAME: 4J BREWING COMPANY, CITY: HOUSTON, STATE: TEXAS, COUNTRY: UNITED STATES
NAME: 4KD CRICK BREWERY, CITY: DEFIANCE, STATE: OHIO, COUNTRY: UNITED STATES
NAME: 4TH TAP BREWING COOPERATIVE, CITY: AUSTIN, STATE: TEXAS, COUNTRY: UNITED STATES
NAME: 5 ALARM BREWING CO, CITY: LAKE MILLS, STATE: IOWA, COUNTRY: UNITED STATES
NAME: 5 LAKES BREWING CO., CITY: DORR, STATE: MICHIGAN, COUNTRY: UNITED STATES
NAME: 5 LAMPS BREWERY, CITY: DUBLIN, STATE: DUBLIN, COUNTRY: IRELAND
NAME: 5 NORTH BREWING COMPANY, CITY: SPOKANE, STATE: WASHINGTON, COUNTRY: UNITED STATES
NAME: 5 RABBIT CERVECERIA INC, CITY: CHICAGO, STATE: ILLINOIS, COUNTRY: UNITED STATES
NAME: 5 RIGHTS BREWING CO, CITY: MARYSVILLE, STATE: WASHINGTON, COUNTRY: UNITED STATES
NAME: 5 RIVERS BREWING LLC, CITY: SPANISH FORT, STATE: ALABAMA, COUNTRY: UNITED STATES
NAME: 5 SEASONS BREWING CO - PRADO, CITY: SANDY SPRINGS, STATE: GEORGIA, COUNTRY: UNITED STATES
NAME: 5 SEASONS BREWING CO - WESTSIDE, CITY: ATLANTA, STATE: GEORGIA, COUNTRY: UNITED STATES
NAME: 5 STONES ARTISAN BREWERY, CITY: NEW BRAUNFELS, STATE: TEXAS, COUNTRY: UNITED STATES
NAME: 515 BREWING CO, CITY: CLIVE, STATE: IOWA, COUNTRY: UNITED STATES
NAME: 5150 BREWING AT THE BRASS TAP ROCKLIN, CITY: ROCKLIN, STATE: CALIFORNIA, COUNTRY: UNITED STATES
NAME: 51ST STATE BREWING COMPANY, CITY: KINGSFORD, STATE: MICHIGAN, COUNTRY: UNITED STATES
NAME: 51ST WARD BEER COMPANY, CITY: WESTMONT, STATE: ILLINOIS, COUNTRY: UNITED STATES
NAME: 54-40 BREWING COMPANY, CITY: WASHOUGAL, STATE: WASHINGTON, COUNTRY: UNITED STATES
NAME: 550 BREWING, CITY: AZTEC, STATE: NEW MEXICO, COUNTRY: UNITED STATES
NAME: 559 LOCAL BREWING, CITY: CLOVIS, STATE: CALIFORNIA, COUNTRY: UNITED STATES
NAME: 56 BREWING, CITY: MINNEAPOLIS, STATE: MINNESOTA, COUNTRY: UNITED STATES
NAME: 5770 BREWERY, CITY: TEUTOPOLIS, STATE: ILLINOIS, COUNTRY: UNITED STATES
NAME: 583 양조장(583 BREWERY), CITY: JANGSU-GUN, STATE: JEOLLABUKDO, COUNTRY: SOUTH KOREA
NAME: 5TH ELEMENT BREWING, CITY: LEANDER, STATE: TEXAS, COUNTRY: UNITED STATES
NAME: 5TH LINE BREWING CO, CITY: YAKIMA, STATE: WASHINGTON, COUNTRY: UNITED STATES
NAME: 5X5 BREWING CO., CITY: MISSION, STATE: TEXAS, COUNTRY: UNITED STATES
NAME: 6 & 40 BREWERY/TAPROOM, CITY: LAKEWOOD, STATE: COLORADO, COUNTRY: UNITED STATES
NAME: 6 BEARS & A GOAT BREWING COMPANY, LLC, CITY: FREDERICKSBURG, STATE: VIRGINIA, COUNTRY: UNITED STATES
NAME: 6 BRIDGES BREWING, CITY: JOHNS CREEK, STATE: GEORGIA, COUNTRY: UNITED STATES
NAME: 6 DEGREES OF SEPARATION, CITY: OSSINING, STATE: NEW YORK, COUNTRY: UNITED STATES
NAME: 603 BREWERY, CITY: LONDONDERRY, STATE: NEW HAMPSHIRE, COUNTRY: UNITED STATES
NAME: 608 BREWING COMPANY, CITY: LA CROSSE, STATE: WISCONSIN, COUNTRY: UNITED STATES
NAME: 612 BREW, CITY: MINNEAPOLIS, STATE: MINNESOTA, COUNTRY: UNITED STATES
NAME: 6TH AND LA BREA, CITY: LOS ANGELES, STATE: CALIFORNIA, COUNTRY: UNITED STATES
NAME: 7 DEVILS BREWING CO, CITY: COOS BAY, STATE: OREGON, COUNTRY: UNITED STATES
NAME: 7 HERMITS BREWING COMPANY, CITY: EAGLE, STATE: COLORADO, COUNTRY: UNITED STATES
NAME: 7 HILLS BREWING COMPANY, CITY: DUBUQUE, STATE: IOWA, COUNTRY: UNITED STATES
NAME: 7 LOCKS BREWING, CITY: ROCKVILLE, STATE: MARYLAND, COUNTRY: UNITED STATES
NAME: 7 MILE BREWERY, CITY: RIO GRANDE, STATE: NEW JERSEY, COUNTRY: UNITED STATES
NAME: 7 SEAS BREWING CO, CITY: TACOMA, STATE: WASHINGTON, COUNTRY: UNITED STATES
NAME: 7 SINS BREWERY, CITY: RIPLEY, STATE: NEW YORK, COUNTRY: UNITED STATES
NAME: 7 SISTERS BREWING CO, CITY: SAN LUIS OBISPO, STATE: CALIFORNIA, COUNTRY: UNITED STATES
NAME: 718BREWCAFE, LLP, CITY: METROPOLIS, STATE: ILLINOIS, COUNTRY: UNITED STATES
NAME: 734 BREWING COMPANY, CITY: YPSILANTI, STATE: MICHIGAN, COUNTRY: UNITED STATES
NAME: 7TH SETTLEMENT BREWERY, CITY: DOVER, STATE: NEW HAMPSHIRE, COUNTRY: UNITED STATES
NAME: 7TH WAVE BREWING, CITY: MEDFIELD, STATE: MASSACHUSETTS, COUNTRY: UNITED STATES
NAME: 7VENTH SUN BREWERY, CITY: DUNEDIN, STATE: FLORIDA, COUNTRY: UNITED STATES
NAME: 7VENTH SUN TAMPA, CITY: TAMPA, STATE: FLORIDA, COUNTRY: UNITED STATES
NAME: 8 BIT BREWING COMPANY, CITY: MURRIETA, STATE: CALIFORNIA, COUNTRY: UNITED STATES
NAME: 8-BIT ALEWORKS, CITY: AVONDALE, STATE: ARIZONA, COUNTRY: UNITED STATES
NAME: 81 ARTISAN, CITY: CHICHESTER, STATE: WEST SUSSEX, COUNTRY: ENGLAND
NAME: 81BAY BREWING COMPANY, CITY: TAMPA, STATE: FLORIDA, COUNTRY: UNITED STATES
NAME: 841 BREWHOUSE, CITY: WHITEWATER, STATE: WISCONSIN, COUNTRY: UNITED STATES
NAME: 8ONE8 BREWING COMPANY, CITY: CANOGA PARK, STATE: CALIFORNIA, COUNTRY: UNITED STATES
NAME: 8TH STREET ALE HAUS, CITY: SHEBOYGAN, STATE: WISCONSIN, COUNTRY: UNITED STATES
NAME: 8TH WARD BREWING COMPANY, CITY: POUGHKEEPSIE, STATE: NEW YORK, COUNTRY: UNITED STATES
NAME: 8TH WONDER BREWERY, CITY: HOUSTON, STATE: TEXAS, COUNTRY: UNITED STATES
NAME: 9 WHITE DEER BREWERY, CITY: MACROOM, STATE: CORK, COUNTRY: IRELAND
NAME: 903 BREWERS, CITY: SHERMAN, STATE: TEXAS, COUNTRY: UNITED STATES
NAME: 927 BEER COMPANY, CITY: CAMBRIA, STATE: CALIFORNIA, COUNTRY: UNITED STATES
NAME: 93 OCTANE BREWERY, CITY: SAINT CHARLES, STATE: ILLINOIS, COUNTRY: UNITED STATES
NAME: 95ATE5 BREWPUB, CITY: SAINT JOHN, STATE: INDIANA, COUNTRY: UNITED STATES
NAME: 9TH HOUR BREWING COMPANY LLC, CITY: SPRING GROVE, STATE: ILLINOIS, COUNTRY: UNITED STATES
NAME: A HOMESTEAD BREW, CITY: VALLEY SPRINGS, STATE: SOUTH DAKOTA, COUNTRY: UNITED STATES
NAME: A LITTLE MADNESS BREWING COMPANY, CITY: PENSACOLA, STATE: FLORIDA, COUNTRY: UNITED STATES
NAME: AARDWOLF BREWING COMPANY, CITY: JACKSONVILLE, STATE: FLORIDA, COUNTRY: UNITED STATES
NAME: ABANDON BREWING, CITY: PENN YAN, STATE: NEW YORK, COUNTRY: UNITED STATES
NAME: ABANDONED BUILDING BREWERY, CITY: EASTHAMPTON, STATE: MASSACHUSETTS, COUNTRY: UNITED STATES
NAME: ABBEY BREWING CO, CITY: MIAMI BEACH, STATE: FLORIDA, COUNTRY: UNITED STATES
NAME: ABBEY BREWING COMPANY, LLC, CITY: SANTA FE, STATE: NEW MEXICO, COUNTRY: UNITED STATES
NAME: ABERRANT ALES, CITY: HOWELL, STATE: MICHIGAN, COUNTRY: UNITED STATES
NAME: ABIDE BREWING COMPANY, CITY: NEWNAN, STATE: GEORGIA, COUNTRY: UNITED STATES
NAME: ABIGAILE, CITY: HERMOSA BEACH, STATE: CALIFORNIA, COUNTRY: UNITED STATES
NAME: ABITA BREWING CO, CITY: COVINGTON, STATE: LOUISIANA, COUNTRY: UNITED STATES
NAME: ABJURATION BREWING, CITY: MC KEES ROCKS, STATE: PENNSYLVANIA, COUNTRY: UNITED STATES
NAME: ABLE BAKER BREWING, CITY: HENDERSON, STATE: NEVADA, COUNTRY: UNITED STATES
NAME: ABLE EBENEZER BREWING COMPANY, CITY: MERRIMACK, STATE: NEW HAMPSHIRE, COUNTRY: UNITED STATES
NAME: ABLE SEEDHOUSE AND BREWERY, CITY: MINNEAPOLIS, STATE: MINNESOTA, COUNTRY: UNITED STATES
NAME: ABNER'S RESTAURANT INC / NORTHERN MICHIGAN BEER, CITY: BROHMAN, STATE: MICHIGAN, COUNTRY: UNITED STATES
NAME: ABNORMAL BEER COMPANY, CITY: SAN DIEGO, STATE: CALIFORNIA, COUNTRY: UNITED STATES
NAME: ABOLITIONIST ALE WORKS, CITY: CHARLES TOWN, STATE: WEST VIRGINIA, COUNTRY: UNITED STATES
NAME: ABRIDGED BEER COMPANY, CITY: KNOXVILLE, STATE: TENNESSEE, COUNTRY: UNITED STATES
NAME: ABSOLUTION BREWING CO, CITY: TORRANCE, STATE: CALIFORNIA, COUNTRY: UNITED STATES
NAME: ABSOLUTION BY THE SEA, CITY: LA JOLLA, STATE: CALIFORNIA, COUNTRY: UNITED STATES
NAME: ABYSS BREWING LTD, CITY: UCKFIELD, STATE: EAST SUSSEX, COUNTRY: ENGLAND
NAME: ACCOMPLICE BEER COMPANY, CITY: CHEYENNE, STATE: WYOMING, COUNTRY: UNITED STATES
NAME: ACIDULOUS BREWING COMPANY, CITY: LITTLETON, STATE: COLORADO, COUNTRY: UNITED STATES
NAME: ACOPON BREWING CO, CITY: DRIPPING SPRINGS, STATE: TEXAS, COUNTRY: UNITED STATES
NAME: ACORN BREWING, CITY: EDGEWOOD, STATE: WASHINGTON, COUNTRY: UNITED STATES
NAME: ACOUSTIC ALES BREWING EXPERIMENT, CITY: SAN DIEGO, STATE: CALIFORNIA, COUNTRY: UNITED STATES
NAME: ACTUAL BREWING COMPANY, LLC, CITY: COLUMBUS, STATE: OHIO, COUNTRY: UNITED STATES
NAME: ADAM'S NORTHWEST BISTRO / TWIN RIVERS BREWING, CITY: MONROE, STATE: WASHINGTON, COUNTRY: UNITED STATES
NAME: ADELBERT'S BREWERY LLC, CITY: AUSTIN, STATE: TEXAS, COUNTRY: UNITED STATES
NAME: ADIRONDACK PUB AND BREWERY, CITY: LAKE GEORGE, STATE: NEW YORK, COUNTRY: UNITED STATES
NAME: ADIRONDACK TOBOGGAN COMPANY MICROBREWERY, CITY: GOUVERNEUR, STATE: NEW YORK, COUNTRY: UNITED STATES
NAME: ADMERK CORP. INC., CITY: WASHINGTON, STATE: DISTRICT OF COLUMBIA, COUNTRY: UNITED STATES
NAME: ADOBE CREEK BREWING COMPANY, CITY: NOVATO, STATE: CALIFORNIA, COUNTRY: UNITED STATES
NAME: ADROIT THEORY BREWING COMPANY, CITY: PURCELLVILLE, STATE: VIRGINIA, COUNTRY: UNITED STATES
NAME: ADUR BREWERY, CITY: STEYNING, STATE: WEST SUSSEX, COUNTRY: ENGLAND
NAME: ADVENTURE BREWING CO, CITY: FREDERICKSBURG, STATE: VIRGINIA, COUNTRY: UNITED STATES
NAME: ADVENTURE SOUTH, CITY: FREDERICKSBURG, STATE: VIRGINIA, COUNTRY: UNITED STATES
NAME: AERO CRAFT BREWING, CITY: DENVER, STATE: COLORADO, COUNTRY: UNITED STATES
NAME: AERO PLAINS BREWING, CITY: WICHITA, STATE: KANSAS, COUNTRY: UNITED STATES
NAME: AERONAUT BREWING COMPANY, CITY: SOMERVILLE, STATE: MASSACHUSETTS, COUNTRY: UNITED STATES
NAME: AFTERSHOCK BREWING CO, CITY: TEMECULA, STATE: CALIFORNIA, COUNTRY: UNITED STATES
NAME: AFTERTHOUGHT BREWING COMPANY, CITY: LOMBARD, STATE: ILLINOIS, COUNTRY: UNITED STATES
NAME: AGAINST THE GRAIN BEER GARDEN, CITY: LOUISVILLE, STATE: KENTUCKY, COUNTRY: UNITED STATES
NAME: AGAINST THE GRAIN BREWERY, CITY: LOUISVILLE, STATE: KENTUCKY, COUNTRY: UNITED STATES
NAME: AGAINST THE GRAIN PRODUCTION FACILITY, CITY: LOUISVILLE, STATE: KENTUCKY, COUNTRY: UNITED STATES
NAME: AGONIC BREWING COMPANY LLC, CITY: RICE LAKE, STATE: WISCONSIN, COUNTRY: UNITED STATES
NAME: AGRARIAN ALES, LLC, CITY: EUGENE, STATE: OREGON, COUNTRY: UNITED STATES
NAME: AHNAPEE BREWERY, CITY: ALGOMA, STATE: WISCONSIN, COUNTRY: UNITED STATES
NAME: AIGEAN ALES, CITY: MANCHESTER, STATE: NEW HAMPSHIRE, COUNTRY: UNITED STATES
NAME: AIKEN BREWING CO, CITY: AIKEN, STATE: SOUTH CAROLINA, COUNTRY: UNITED STATES
NAME: AIRLINE BREWING COMPANY, CITY: AMHERST, STATE: MAINE, COUNTRY: UNITED STATES
NAME: AIRWAYS BREWING CO, CITY: KENT, STATE: WASHINGTON, COUNTRY: UNITED STATES
NAME: AIRWAYS BREWING CO. BISTRO & BEER GARDEN, CITY: KENT, STATE: WASHINGTON, COUNTRY: UNITED STATES
NAME: AKADEMIA BREWING COMPANY, CITY: ATHENS, STATE: GEORGIA, COUNTRY: UNITED STATES
NAME: AKASHA BREWING COMPANY, CITY: LOUISVILLE, STATE: KENTUCKY, COUNTRY: UNITED STATES
NAME: AKRONYM BREWING LLC, CITY: AKRON, STATE: OHIO, COUNTRY: UNITED STATES
NAME: AKWESASNE MOHAWK CASINO RESORT, CITY: AKWESASNE, STATE: NEW YORK, COUNTRY: UNITED STATES
NAME: ALAMEDA BREWING CO, CITY: PORTLAND, STATE: OREGON, COUNTRY: UNITED STATES
NAME: ALAMEDA BREWING CO, CITY: PORTLAND, STATE: OREGON, COUNTRY: UNITED STATES
NAME: ALAMEDA ISLAND BREWING COMPANY, CITY: ALAMEDA, STATE: CALIFORNIA, COUNTRY: UNITED STATES
NAME: ALAMO BEER CO, CITY: SAN ANTONIO, STATE: TEXAS, COUNTRY: UNITED STATES
NAME: ALARMIST BREWING CO, CITY: CHICAGO, STATE: ILLINOIS, COUNTRY: UNITED STATES
NAME: ALARO CRAFT BREWERY, CITY: SACRAMENTO, STATE: CALIFORNIA, COUNTRY: UNITED STATES
NAME: ALASKAN BREWING CO., CITY: JUNEAU, STATE: ALASKA, COUNTRY: UNITED STATES
NAME: ALBIA BREWING CO, CITY: ALBIA, STATE: IOWA, COUNTRY: UNITED STATES
NAME: ALBION MALLEABLE BREWING COMPANY, CITY: ALBION, STATE: MICHIGAN, COUNTRY: UNITED STATES
NAME: ALBRIGHT GROVE BREWING COMPANY, CITY: TOWNSEND, STATE: TENNESSEE, COUNTRY: UNITED STATES
NAME: ALCATRAZ BREWING, CITY: PALM COAST, STATE: FLORIDA, COUNTRY: UNITED STATES
NAME: ALCAZAR BREWERY, LLC., CITY: RIO GRANDE CITY, STATE: TEXAS, COUNTRY: UNITED STATES
NAME: ALCHEMIST CANNERY, CITY: WATERBURY, STATE: VERMONT, COUNTRY: UNITED STATES
NAME: ALDUS BREWING COMPANY, CITY: HANOVER, STATE: PENNSYLVANIA, COUNTRY: UNITED STATES
NAME: ALE ASYLUM, CITY: MADISON, STATE: WISCONSIN, COUNTRY: UNITED STATES
NAME: ALE HOUSE BREWING CO, CITY: SAN JOSE, STATE: CALIFORNIA, COUNTRY: UNITED STATES
NAME: ALE INDUSTRIES, CITY: OAKLAND, STATE: CALIFORNIA, COUNTRY: UNITED STATES
NAME: ALE REPUBLIC, CITY: CEDAR CREST, STATE: NEW MEXICO, COUNTRY: UNITED STATES
NAME: ALE SPIKE, CITY: STANWOOD, STATE: WASHINGTON, COUNTRY: UNITED STATES
NAME: ALE SPIKE BREWERY, CITY: CAMANO ISLAND, STATE: WASHINGTON, COUNTRY: UNITED STATES
NAME: ALEMAN BREWING, CITY: CHICAGO, STATE: ILLINOIS, COUNTRY: UNITED STATES
NAME: ALEMATIC ARTISAN ALES, CITY: HUBER HEIGHTS, STATE: OHIO, COUNTRY: UNITED STATES
NAME: ALESATIAN BREWING CO., CITY: WINCHESTER, STATE: VIRGINIA, COUNTRY: UNITED STATES
NAME: ALESMITH BREWING CO, CITY: SAN DIEGO, STATE: CALIFORNIA, COUNTRY: UNITED STATES
NAME: ALESONG BREWING AND BLENDING, CITY: EUGENE, STATE: OREGON, COUNTRY: UNITED STATES
NAME: ALESONG BREWING AND TASTING ROOM, CITY: EUGENE, STATE: OREGON, COUNTRY: UNITED STATES
NAME: ALEWERKS BREWING COMPANY, CITY: WILLIAMSBURG, STATE: VIRGINIA, COUNTRY: UNITED STATES
NAME: ALEWIFE BREWING COMPANY, CITY: LONG ISLAND CITY, STATE: NEW YORK, COUNTRY: UNITED STATES
NAME: ALEXANDRIA BREWING COMPANY, CITY: ALEXANDRIA, STATE: KENTUCKY, COUNTRY: UNITED STATES
NAME: ALGARVE ROCK BREWERY, CITY: FARO, STATE: FARO, COUNTRY: PORTUGAL
NAME: ALIBI ALE WORKS, CITY: INCLINE VILLAGE, STATE: NEVADA, COUNTRY: UNITED STATES
NAME: ALIEN BREWPUB, CITY: ALBUQUERQUE, STATE: NEW MEXICO, COUNTRY: UNITED STATES
NAME: ALIGN BREWING CO, CITY: SAN DIEGO, STATE: CALIFORNIA, COUNTRY: UNITED STATES
NAME: ALL RISE BREWING CO, CITY: CHICAGO, STATE: ILLINOIS, COUNTRY: UNITED STATES
NAME: ALL SAINTS BREWING CO, CITY: GREENSBURG, STATE: PENNSYLVANIA, COUNTRY: UNITED STATES
NAME: ALL-AMERICAN ALE WORKS, CITY: ANAHEIM, STATE: CALIFORNIA, COUNTRY: UNITED STATES
NAME: ALLAGASH BREWING CO, CITY: PORTLAND, STATE: MAINE, COUNTRY: UNITED STATES
NAME: ALLEGHENY CITY BREWING, CITY: PITTSBURGH, STATE: PENNSYLVANIA, COUNTRY: UNITED STATES
NAME: ALLEGORY BREWING, CITY: MCMINNVILLE, STATE: OREGON, COUNTRY: UNITED STATES
NAME: ALLENTOWN BREW WORKS, CITY: ALLENTOWN, STATE: PENNSYLVANIA, COUNTRY: UNITED STATES
NAME: ALLIANCE BREWING COMPANY, CITY: KNOXVILLE, STATE: TENNESSEE, COUNTRY: UNITED STATES
NAME: ALLIGATOR BREWING / TALL PAUL'S BREWHOUSE, CITY: GAINESVILLE, STATE: FLORIDA, COUNTRY: UNITED STATES
NAME: ALLOY BREWING COMPANY, CITY: COON RAPIDS, STATE: MINNESOTA, COUNTRY: UNITED STATES
NAME: ALLTECH'S LEXINGTON BREWING, CITY: LEXINGTON, STATE: KENTUCKY, COUNTRY: UNITED STATES
NAME: ALLUVIAL BREWING COMPANY, CITY: AMES, STATE: IOWA, COUNTRY: UNITED STATES
NAME: ALMA BREWING CO, CITY: ALMA, STATE: MICHIGAN, COUNTRY: UNITED STATES
NAME: ALMA MADER BREWING, CITY: KANSAS CITY, STATE: MISSOURI, COUNTRY: UNITED STATES
NAME: ALMANAC BEER COMPANY, CITY: ALAMEDA, STATE: CALIFORNIA, COUNTRY: UNITED STATES
NAME: ALMOST FAMOUS BREWING COMPANY, CITY: EAST GRANBY, STATE: CONNECTICUT, COUNTRY: UNITED STATES
NAME: ALOHA BEER CO, CITY: HONOLULU, STATE: HAWAII, COUNTRY: UNITED STATES
NAME: ALOSTA BREWING CO, CITY: COVINA, STATE: CALIFORNIA, COUNTRY: UNITED STATES
NAME: ALPENGLOW BEER CO, CITY: LAFAYETTE, STATE: CALIFORNIA, COUNTRY: UNITED STATES
NAME: ALPHA ACID BREWING CO, CITY: BELMONT, STATE: CALIFORNIA, COUNTRY: UNITED STATES
NAME: ALPHA BREWING CO., CITY: SAINT LOUIS, STATE: MISSOURI, COUNTRY: UNITED STATES
NAME: ALPHABET CITY BREWING CO, CITY: NEW YORK, STATE: NEW YORK, COUNTRY: UNITED STATES
NAME: ALPINE BEER COMPANY, CITY: SAN DIEGO, STATE: CALIFORNIA, COUNTRY: UNITED STATES
NAME: ALPINE BREWING CO, CITY: OROVILLE, STATE: WASHINGTON, COUNTRY: UNITED STATES
NAME: ALPINE DOG BREWING CO, CITY: DENVER, STATE: COLORADO, COUNTRY: UNITED STATES
